323,"Somos un hostal pequeño, contamos con 14 habitaciones dobles con balcón. Estamos en una ubicación excelente, a 1´ de la Gran Via, 5´ de la Puerta del Sol. El desayuno es tipo buffet y está incluído en la tarifa. Tendrás tus llaves para moverte sin necesidad de dejarlas en recepción. Estaremos siempre dispuestos a darte información y ayudarte para que puedas disfrutar al máximo tu visita a Madrid.",Hostal la Zona,111,4.0,"Calle de Valverde, 7, 28004, Madrid",Sol,40.420994,-3.7022014,POINT (-3.7022014 40.420994),0,1,0,0,0,0,0,0,0,1,0,0,0,0,1,0,0,0,0,0,0,0,0,0,0,0,0,0,0,0,0,0,0,0,0,0,0,0,0,0,0,0,0,0,0,0,0,0,0,0,0,0,0,1,0,0,0,0,0,0,0,0,0,0,0,0,0,0,0,0,0,0,0,1,0,0,1,0,0,0,0,0,0,0,0,0,0,0,0,0,0,0,0,0,0,1,0,0,0,0,0,0,0,0,0,0,0,0,0,0,0,0,0,0,0,0,0,0,0,0,0,0,0,0,0,0,0,0,0,0,0,0,0,0,0,0,0,0,0,0,0,0,0,0,0,0,0,0,0,0,0,0,0,0,0,0,0,0,0,0,0,0,0,0,0,0,0,0,0,0,0,0,0,0,1,0,0,0,0,0,0,0,0,0,0
324,"El Hostal el Pilar es un negocio de gestión familiar situado justo en el centro de la ciudad de Madrid. Las habitaciones disponen de baño privado completo, televisión, teléfono, caja de seguridad, aire acondicionado y wifi gratuito. En recepción, que permanece abierta y atendida las 24 horas, se pueden encontrar máquinas de snack con productos fríos y calientes. Servicio de lavandería.",Hostal El Pilar,71,3.5,"Calle Carretas, 13, 28012, Madrid",Barrio no encontrado,40.815899,-3.601826676355436,POINT (-3.601826676355436 40.815899),0,1,0,0,0,0,0,0,0,1,1,1,0,0,1,1,1,0,0,0,0,0,0,0,0,0,0,0,0,0,0,0,0,0,0,1,0,1,0,1,0,0,0,1,1,0,0,0,0,0,0,0,0,0,0,1,0,0,0,0,0,0,0,0,0,0,0,0,0,0,0,0,0,1,0,0,1,0,0,0,0,0,0,0,0,0,1,0,0,0,0,0,0,0,0,0,0,0,0,0,0,0,0,0,0,0,0,0,0,0,0,0,0,0,0,0,0,0,0,0,0,0,0,0,0,0,0,0,0,0,0,0,0,0,0,0,0,0,0,0,0,0,0,0,0,0,0,0,0,0,0,0,0,0,0,0,0,0,0,0,0,0,0,0,0,0,0,0,0,0,0,0,0,0,1,0,0,0,0,0,0,0,0,0,0
325,"Lo mas destacable del hotel es la relación precio calidad. Las instalaciones del hotel parecen recicladas a nuevas. Las habitaciones cuentan con frigobar, wifi, cocina eléctrica, aire acondicionado, microondas, ollas y demás para que tranquilamente puedas cocinar allí. Por esto último no incluye desayuno. La habitación que nos tocó es bastante amplia con un baño excelente. Quizás podría criticarse que el colchón no es de lo mejor. Es importante destacar la ubicación a 2 cuadras de una estación de subte ya que no se encuentra tan cerca del centro pero tampoco tan lejos. El hotel se encuentar en una calle donde no transitan muchos vehículos, por ende el ruido del exterior es imperceptible. Es destacable tambien la atención del personal que se encuentra en la recepción.",Aparthotel Avenida de America,114,4.0,"Calle de Béjar, 29, 28028, Madrid",Guindalera,40.4370785,-3.6720618,POINT (-3.6720618 40.4370785),0,1,0,0,0,0,0,0,0,1,1,0,0,1,1,1,0,0,0,0,0,0,0,0,0,0,0,0,0,0,0,0,0,0,0,1,0,1,0,1,0,0,0,0,0,0,0,0,0,0,0,0,0,0,0,0,0,0,0,0,0,0,1,0,0,0,0,0,0,0,0,0,0,1,0,0,1,0,0,0,0,0,0,0,0,0,0,0,0,0,0,0,0,0,0,0,0,0,0,0,0,0,0,0,0,0,0,0,0,0,0,0,0,0,0,0,0,0,0,0,0,0,0,0,0,0,0,0,0,0,0,0,0,0,0,0,1,0,0,0,0,0,0,0,0,0,0,0,0,0,0,0,0,0,0,0,0,0,0,0,0,0,0,0,0,0,0,0,0,0,0,0,0,0,1,0,1,0,1,0,0,0,0,0,0
326,"Todo nuevo, impecable, limpio. Mención aparte para la cordialidad del staff. Trato amistoso, cálido, siempre bien predispuestos. Inmejorable ubicación. Ofrecen en la cocina compartida, café, mermelada, etc. Colchones y sábanas de muy buena calidad.",Modular Rooms Hotels,56,5.0,"Calle Espada, 4, 28012, Madrid",Embajadores,40.4118126,-3.7047687,POINT (-3.7047687 40.4118126),0,0,0,0,0,0,0,0,0,0,0,0,0,0,0,0,0,0,0,0,0,0,0,0,0,0,0,0,0,0,0,0,0,0,0,0,0,0,0,0,0,0,0,0,0,0,0,0,0,0,0,0,0,0,0,0,0,0,0,0,0,0,0,0,0,0,0,0,0,0,0,0,0,0,0,0,0,0,0,0,0,0,0,0,0,0,0,0,0,0,0,0,0,0,0,0,0,0,0,0,0,0,0,0,0,0,0,0,0,0,0,0,0,0,0,0,0,0,0,0,0,0,0,0,0,1,0,0,0,0,0,0,0,0,0,0,0,0,0,0,0,0,0,0,0,0,0,0,0,0,0,0,0,0,0,0,0,0,0,0,0,0,0,0,0,0,0,0,0,0,0,0,0,0,0,0,0,0,0,0,0,0,0,1,0
327,"Bienvenido a AC Hotel Cuzco, tu segundo hogar en Madrid. AC Hotel Cuzco tiene como objetivo conseguir que tu visita sea lo más relajante y agradable posible, razón por la que tantos huéspedes siguen volviendo año tras año.
Como está muy cerca de conocidos puntos de referencia, como Malasaña (3,5 km) y Barrio de Salamanca (3,6 km), los huéspedes de Ac Cuzco pueden acceder con facilidad a algunas de las atracciones más conocidas de Madrid.
Las habitaciones de los huéspedes ofrecen servicios como televisor de pantalla plana, minibar y aire acondicionado, y los huéspedes pueden permanecer conectados con wifi gratuito que ofrece el hotel.",AC Hotel by Marriott Cuzco,177,4.0,"Paseo de la Castellana, 28046, Madrid",Almenara,40.4739354,-3.6871057,POINT (-3.6871057 40.4739354),0,1,0,1,0,0,1,0,0,1,1,1,1,1,1,1,0,1,0,0,1,0,0,0,0,0,0,0,0,0,0,0,1,0,0,1,1,0,0,0,0,0,0,0,0,0,0,0,0,0,0,0,1,0,0,0,0,0,0,0,0,0,0,0,0,0,0,0,0,0,0,0,0,0,0,0,0,0,0,0,0,0,0,0,0,0,0,0,0,0,0,0,0,0,0,0,0,0,0,0,0,0,0,0,0,0,0,0,0,0,0,0,0,0,0,0,0,0,0,0,0,0,0,0,0,0,0,0,0,0,0,0,0,0,0,0,0,0,0,0,0,0,0,0,0,0,0,0,0,0,0,0,0,0,0,0,0,0,0,0,0,0,0,0,0,0,0,0,0,0,0,0,0,0,1,1,0,0,0,0,0,0,0,0,0
328,"Si buscas un hotel junto al Campo de las Naciones, con metro en la puerta y amplias habitaciones , no te pierdas Pullman Madrid Airport & Feria. Pullman Madrid Airport & Feria es un hotel tanto para clientes de negocios como de ocio, sus habitaciones cuentan con televisor de pantalla plana, minibar y aire acondicionado, y es fácil permanecer conectado durante la estancia, ya que ofrece wifi gratuito para los huéspedes. El hotel tiene recepción abierta 24 horas, conserje y servicio de habitaciones. Además, los huéspedes pueden disfrutar de piscina y bar, lo que lo ha convertido en una opción popular entre los viajeros que visitan Madrid. Para los huéspedes que tengan coche, hay aparcamiento disponible. Mientras estés en Madrid, quizás quieras probar algunos de los restaurantes que hay cerca de Pullman Madrid, como La Gran Pulpería (1,0 km), Bahía Taberna (2,0 km) y Restaurante El Guero (1,8 km). Si te interesa explorar Madrid, visita los museos más importantes de Madrid cómo el Prado, Thyssen y Reina Sofia o museos militares como La Real Armería de Madrid, Museo del Ejército y Museo de Medios Acorazados. El personal de Pullman Madrid Airport & Feria está deseando atenderte durante tu visita.",Pullman Madrid Airport & Feria,131,4.0,"Avenida Capital de España, 10, 28042, Madrid",Corralejos,40.4643051,-3.6162254,POINT (-3.6162254 40.4643051),0,1,0,1,0,1,1,0,0,1,0,1,1,0,1,0,0,1,0,0,1,0,0,0,1,0,0,0,0,0,0,0,1,0,1,0,0,0,0,1,0,0,0,0,0,0,0,0,1,0,0,0,0,0,0,0,0,0,0,0,0,0,0,0,0,1,0,0,0,0,0,0,0,0,0,0,0,0,0,0,0,0,0,0,0,0,0,0,0,0,0,0,0,0,0,0,0,0,0,0,0,0,0,0,0,0,0,0,0,0,0,0,0,0,0,0,0,0,0,0,0,0,0,0,0,0,0,0,0,0,0,0,0,0,0,0,0,0,0,0,0,0,0,0,0,0,0,0,0,0,0,0,0,0,0,0,0,0,0,0,0,0,0,0,0,0,0,0,0,0,0,0,0,0,1,1,1,0,1,0,0,0,0,0,0
329,"Con 71 habitaciones, gimnasio, salas de reuniones, conexión Wi-Fi gratuita y espacios singulares como su espectacular terraza, el huésped dispondrá de todo lo necesario para hacer su estancia única, tanto para aquellos que viajen por negocios como por placer. Revive la Historia de la ciudad y su arteria principal a través del Hotel Círculo Gran Vía.","Círculo Gran Vía, Autograph Collection",341,4.5,"Calle Gran Vía, 24, 28013, Madrid",Barrio no encontrado,40.4721259,-3.8718142,POINT (-3.8718142 40.4721259),0,1,0,1,0,1,1,0,0,1,1,0,0,1,1,1,1,1,0,1,0,0,1,0,0,0,0,0,0,0,0,0,0,0,0,0,0,0,0,0,0,0,0,0,0,0,0,0,0,0,0,0,0,0,0,0,0,0,0,0,0,0,0,0,0,0,0,0,0,0,0,0,0,0,0,0,0,0,0,0,0,0,0,0,0,0,0,0,0,0,0,0,0,0,0,0,0,0,0,0,0,0,0,0,0,0,0,0,0,0,0,0,0,1,0,0,0,0,0,0,0,0,0,0,0,0,0,0,0,0,0,0,0,0,0,0,0,0,0,0,0,0,0,0,0,0,0,0,0,0,0,0,0,0,0,0,1,0,0,0,0,0,0,0,0,0,0,0,0,0,0,0,0,0,1,1,1,0,0,0,0,0,0,0,0
330,"Si buscas un hotel para familias en Madrid, no te pierdas Hostal Riesco Puerta del Sol.
Como está cerca de la mayoría de los puntos de referencia de Madrid, como Plaza Mayor (0,3 km) y Plaza de Santa Ana (0,3 km), Hostal Riesco es un fantástico destino para turistas.
Las habitaciones de Hostal Riesco Hotel incluyen televisor de pantalla plana, aire acondicionado y mesa de escritorio para una comodidad mucho mayor, y los huéspedes pueden permanecer conectados con wifi gratuito.",Hostal Riesco Puerta del Sol,125,4.0,"Calle Puerta del Sol, 2, 28012, Madrid",Barrio no encontrado,40.2850278,-3.7469094,POINT (-3.7469094 40.2850278),0,1,0,0,0,0,0,0,0,1,1,0,0,0,1,1,0,0,0,0,0,0,0,0,0,0,0,0,1,0,0,1,0,0,0,1,0,1,0,0,0,0,0,0,1,0,0,0,0,1,0,0,0,0,1,0,0,0,0,0,0,0,0,0,0,0,0,0,0,0,0,0,0,1,0,0,0,0,0,0,1,0,0,0,0,0,0,0,0,0,0,0,0,0,0,0,1,0,0,0,0,0,0,0,0,0,0,0,0,0,0,0,0,0,0,0,0,0,0,0,0,0,0,0,0,0,0,0,0,0,0,0,0,0,0,0,0,0,0,0,0,0,0,0,0,0,1,0,0,0,0,0,0,0,0,0,0,0,0,0,0,0,0,0,0,0,0,0,0,0,0,0,0,0,1,0,0,0,1,0,0,0,0,0,0
331,"Muy contentos con nuestra estancia. La habitación muy limpia, la cama cómoda, el baño (aunque algo pequeño) completo. El desayuno nos lo trajeron a la habitación, algo que nos sorprendió, el zumo de naranja natural y el pan de la tostada muy rico. Hicimos el Check in online y sin problemas. Esperamos volver, ya que estuvimos muy cómodos.",CC Malasaña Bed & Gastro,60,4.0,"Calle del Espíritu Santo, 18, 28004, Madrid",Universidad,40.4252878,-3.7032083,POINT (-3.7032083 40.4252878),0,1,0,0,0,0,0,0,0,1,0,0,0,0,1,1,0,0,0,0,0,0,0,0,0,0,0,0,0,0,0,0,0,0,0,0,1,0,0,0,1,0,0,0,0,0,0,0,0,0,0,0,0,0,0,0,0,0,0,0,0,0,0,0,0,0,0,0,0,0,0,0,0,1,0,0,1,0,0,0,0,0,0,0,0,0,0,0,0,0,0,0,0,0,0,0,0,0,0,0,0,0,0,0,0,0,0,0,0,0,0,0,0,0,0,0,0,0,0,0,0,0,0,0,0,0,0,0,0,0,0,0,0,0,0,0,0,0,0,0,0,0,0,0,0,0,0,0,0,0,0,0,0,0,0,0,0,0,0,0,0,0,0,0,0,0,0,0,0,0,0,0,0,0,1,0,0,0,0,0,0,0,0,0,0
332,"Todo el mundo necesita un sitio donde reposar cuando está cansado. Para aquellos que visiten Madrid, Hostal Armesto es una magnífica elección para descansar. Conocido por su ambiente económico y su proximidad a fantásticos restaurantes y atracciones, Hostal Armesto te ayuda a disfrutar de lo mejor de Madrid.
Las habitaciones de Hostal Armesto incluyen aire acondicionado para una comodidad mucho mayor, y los huéspedes pueden permanecer conectados con wifi gratuito.",Hostal Armesto,55,4.0,"Calle de San Agustín, 6, 28014, Madrid",Cortes,40.4147898,-3.6970435,POINT (-3.6970435 40.4147898),0,1,0,0,0,0,0,0,0,1,0,0,0,0,0,0,0,0,0,0,0,0,0,0,0,0,0,0,1,0,0,0,0,0,0,1,0,1,0,1,0,0,0,0,0,0,0,0,0,0,0,0,0,0,0,0,0,0,0,0,0,0,0,0,0,0,0,0,0,0,0,0,0,1,0,0,1,0,0,0,0,0,0,0,0,0,0,0,0,0,0,0,0,0,0,0,0,0,0,0,0,0,0,0,0,0,0,0,0,0,0,0,0,0,0,0,0,0,0,0,0,0,0,0,0,0,0,0,0,0,0,0,0,0,0,0,0,0,0,0,0,0,0,0,0,0,0,0,0,0,0,0,0,0,0,0,0,0,0,0,0,0,0,0,0,0,0,0,0,0,0,0,0,0,1,0,0,0,0,0,0,0,0,0,0
333,"La búsqueda del hostal económico ideal en Madrid no tiene por qué ser complicada. Bienvenido a Hostal Josefina, una fantástica opción para viajeros como tú.
Durante su estancia en Hotel Hostal Josefina, los huéspedes pueden visitar Plaza Mayor (0,6 km) y Plaza de Santa Ana (0,8 km), que son algunas de las principales atracciones de Madrid.
Hotel Hostal Josefina ofrece una gran variedad de servicios en la habitación, como televisor de pantalla plana y aire acondicionado, y puedes permanecer conectado, ya que hay wifi gratuito disponible.",Hostal Josefina,95,3.5,"Calle Gran Vía, 44, 28013, Madrid",Barrio no encontrado,40.4710156,-3.8715259,POINT (-3.8715259 40.4710156),1,1,0,0,0,0,0,0,0,1,0,0,0,0,1,1,0,0,0,0,0,0,0,0,0,0,0,0,0,0,0,0,0,0,0,1,1,1,0,1,1,0,0,1,1,0,0,0,0,1,0,0,0,0,0,0,0,0,0,0,0,0,0,0,0,0,0,0,0,0,0,0,0,0,0,0,0,0,0,0,1,0,0,0,0,0,0,0,0,0,0,0,0,0,0,0,0,0,0,0,0,0,0,1,0,0,0,0,0,0,0,0,0,0,0,0,0,0,0,0,0,0,0,0,0,0,0,0,0,0,0,0,0,0,0,0,0,0,0,0,0,0,0,0,0,0,0,0,0,0,0,0,0,0,0,0,0,1,0,0,0,0,0,0,0,0,0,0,0,0,0,0,0,0,1,0,0,0,0,0,0,0,0,0,0
334,"El hostal está muy bien ubicado, la habitación acogedora y limpia con todos los servicios que necesitas y un trato amable por parte de la dueña. Abajo tienes un par de restaurantes y está cerca de la estación de tren y otras atracciones. Recomendado",Hostal Bruna,114,4.0,"Calle de Moratín, 50, 28014, Madrid",Cortes,40.412476350000006,-3.694414957644628,POINT (-3.694414957644628 40.412476350000006),0,1,0,0,0,0,0,0,0,1,0,0,0,0,1,0,0,0,0,0,0,0,0,0,0,0,0,0,0,0,1,0,0,0,0,1,1,1,0,1,0,0,0,0,0,0,0,0,0,0,0,0,0,0,0,0,0,0,0,0,0,0,0,0,0,0,0,0,0,0,0,0,0,1,0,0,1,0,0,0,0,0,0,0,0,0,0,0,0,0,0,0,0,0,0,0,0,0,0,0,0,0,0,0,0,0,0,0,0,0,0,0,0,0,0,0,0,0,0,0,0,0,0,0,0,0,0,0,0,0,0,0,0,0,0,0,0,0,0,0,0,0,0,0,0,0,0,0,0,0,0,0,0,0,0,0,0,0,0,0,0,0,0,0,0,0,0,0,0,0,0,0,0,0,1,0,0,0,1,0,0,0,0,0,0
335,"B&B te ofrece un apartamento amplio, reformado, muy luminoso y completamente amueblado en Madrid ciudad. B&B Apartamentos Madrid Centro Fuencarral 46 dispone de 20 apartamentos de diferente distribución con el fin de ofrecerte los mejores servicios a medida. Los apartamentos turísticos B&B Fuencarral 46 pueden ser de uno o dos dormitorios y todos cuentan con un bonito salón comedor con un sofá cama de 1.40m x 1.90m de fácil apertura y una cocina totalmente equipada con menaje y otros utensilios. Disponen también de un baño totalmente equipado con ducha de efecto lluvia, TV de pantalla plana LED tanto en el salón como en el dormitorio, aire acondicionado y calefacción individual. El hotel dispone de acceso a internet, en concreto tenemos Wi-Fi de alta velocidad gratuito. También, ponemos a tu disposición un secador de pelo y toallas. Puedes elegir entre nuestros apartamentos de uno o dos dormitorios, apartamento con terraza o estudio. En B&B Hotels Apartamentos Madrid Centro, disponemos de un servicio de atención al cliente las 24 horas del día, los 7 días de la semana. En recepción, nuestro personal atenderá amablemente cualquier duda o información que necesites. Además, puedes disponer de un servicio de limpieza gratuita cada tres días o bien bajo petición con un cargo adicional. El registro, entrega de llaves y pago del apartamento se efectuará en el Hotel B&B Madrid Centro Fuencarral 52, situado justo al lado de los apartamentos.",B&B Apartamentos Madrid Centro Fuencarral 46,101,4.0,"Calle de Fuencarral, 46, 28004, Madrid",Universidad,40.4231848,-3.7006086,POINT (-3.7006086 40.4231848),0,1,0,0,0,1,0,0,0,1,0,0,0,0,0,0,1,0,0,0,0,0,0,0,0,0,0,0,0,0,0,0,0,0,0,0,0,0,0,0,1,0,0,0,0,0,0,0,0,0,0,1,0,0,0,1,0,0,0,0,0,0,0,0,0,0,0,0,0,0,0,1,0,1,0,0,0,0,0,0,0,0,0,0,0,0,0,0,0,0,0,0,0,0,0,0,0,0,0,0,0,0,0,0,0,0,1,0,0,0,0,0,0,0,0,0,0,0,0,0,0,0,0,0,0,0,0,0,0,0,0,0,0,0,0,0,0,0,0,0,0,0,0,0,0,0,0,0,0,0,0,0,0,0,0,0,0,0,0,0,0,0,0,0,0,0,0,0,0,0,0,0,0,0,0,0,0,0,0,0,0,0,0,1,0
336,"Descubre por qué tantos viajeros ven AC Hotel Aitana como el hotel ideal cuando visitan Madrid. Además de aportar la combinación ideal de calidad, comodidad y ubicación, ofrece un ambiente para familias con una amplia variedad de servicios diseñados para viajeros como tú.
Ac Aitana Hotel es un hotel para familias con televisor de pantalla plana, aire acondicionado y minibar en las habitaciones, y es fácil permanecer conectado durante la estancia, ya que ofrece wifi gratuito para los huéspedes.",AC Hotel by Marriott Aitana,139,4.0,"Paseo de la Castellana, 152, 28046, Madrid",Cuatro Caminos,40.4559026,-3.6896531,POINT (-3.6896531 40.4559026),0,1,0,1,0,1,1,0,0,1,1,1,0,0,1,1,1,1,0,1,1,0,0,0,0,0,0,0,0,0,0,0,0,0,0,0,0,0,0,0,0,0,0,0,0,1,0,0,0,1,0,0,0,0,0,0,0,0,0,0,0,0,0,0,0,0,0,0,0,0,0,0,0,0,0,0,0,0,0,0,0,0,0,0,0,0,0,0,0,0,0,0,0,0,0,0,0,0,0,0,0,0,0,0,0,0,0,0,0,0,0,0,0,0,0,0,0,0,0,0,0,0,0,0,0,0,0,0,0,0,0,0,0,0,0,0,0,0,0,0,0,0,0,0,0,0,0,0,0,0,0,0,0,0,0,0,0,0,0,0,0,0,0,0,0,0,0,0,0,0,0,0,0,0,1,1,1,0,0,0,0,0,0,0,0
337,"Cason del Tormes es una magnífica elección para los viajeros que visiten Madrid, ya que ofrece un ambiente tranquilo, además de numerosos servicios diseñados para mejorar tu estancia.
Al estar cerca de los puntos de referencia más conocidos de Madrid, como Malasaña (0,9 km) y Sobrino de Botín (1,0 km), Cason Tormes es un magnífico destino para turistas.
Las habitaciones de Hotel Cason Del Torme incluyen televisor de pantalla plana, aire acondicionado y frigorífico para una comodidad mucho mayor, y los huéspedes pueden permanecer conectados con wifi gratuito.",Cason del Tormes,104,4.0,"Calle del Río, 7, 28013, Madrid",Palacio,40.4222346,-3.7116559,POINT (-3.7116559 40.4222346),0,1,0,1,0,0,0,0,0,1,0,0,1,0,1,0,0,0,0,0,0,0,0,0,0,0,0,0,0,1,0,1,0,0,0,1,1,1,0,1,1,0,0,1,1,0,0,0,0,0,0,1,0,0,0,0,0,0,0,0,0,0,0,1,0,0,0,0,0,0,0,0,0,0,0,0,0,0,0,0,0,0,0,0,0,0,0,0,0,0,0,0,0,0,0,0,0,0,0,0,0,0,0,0,0,0,0,0,0,0,0,0,0,0,0,0,0,0,0,0,0,0,0,0,0,0,0,0,0,0,0,0,0,0,0,0,0,0,0,0,0,0,0,0,0,0,0,0,0,0,0,0,0,0,0,0,0,0,0,0,0,0,0,0,0,0,0,0,0,0,0,0,0,0,1,1,0,0,1,0,0,0,0,0,0
338,"Este hostel esta ubicado al lado del metro alonso martinez y tribunal. Es pequeño, solo tiene una planta, pero tiene un salon con sillones y television. Es acogedor y está limpio, que es importante. Cumple con las expectativas",Bed Madrid,64,3.5,"Calle de San Mateo, 2, 28004, Madrid.",Universidad,40.4249355,-3.7005317,POINT (-3.7005317 40.4249355),0,1,0,0,0,0,0,0,0,1,0,0,0,0,0,0,0,0,0,0,0,0,0,0,0,0,0,0,0,0,0,0,0,0,0,1,0,1,0,0,0,0,0,0,0,0,0,0,0,0,0,0,0,1,0,0,0,0,0,0,0,0,0,0,0,0,0,0,0,0,0,0,0,1,0,0,1,0,0,1,0,0,0,0,0,0,0,0,0,0,0,0,0,0,0,0,0,0,0,0,0,0,0,0,0,0,0,0,0,0,0,0,0,0,0,0,0,0,0,0,0,0,0,0,0,0,0,0,0,0,0,0,0,0,0,0,0,0,0,0,0,0,0,0,0,0,0,0,0,0,0,0,0,0,0,0,0,0,0,0,0,0,0,0,0,0,0,0,0,0,0,0,0,0,0,0,0,0,0,0,0,0,0,1,0
339,"Acogedor y calido apartamento, superbonito, con todo lo necesario para pasar unos dias, es muy centrico, la chica de recepcion supermaja 😄, si podeis, incluir el desayuno, lleva de todo, riquisimo, deseando repetir, sin duda es de los mejores en los que hemos estado en Madrid.",Eric Vökel Boutique Apartments - Madrid Suites,120,4.5,"Calle de San Bernardo, 61, 28015, Madrid",Universidad,40.4262914,-3.7070026,POINT (-3.7070026 40.4262914),0,1,0,0,0,0,0,0,0,1,0,0,0,1,1,1,1,0,0,1,0,0,0,0,0,0,0,0,1,0,0,0,0,0,0,1,0,0,0,1,0,0,0,0,0,0,1,0,0,0,0,0,0,0,0,1,1,0,0,0,0,0,0,0,0,0,0,0,0,0,0,0,0,0,0,0,1,0,0,0,0,0,0,0,0,0,0,0,0,0,0,0,0,0,0,0,0,0,0,0,0,0,0,0,0,0,0,1,0,0,0,0,0,0,0,0,0,0,0,0,0,0,0,0,0,0,0,0,0,0,0,0,0,0,0,0,0,0,0,0,0,0,0,1,0,0,0,0,0,0,0,0,0,0,0,0,0,0,0,0,0,0,0,0,0,0,0,0,0,0,0,0,0,0,1,1,0,1,1,0,0,0,0,0,0
340,Este viage ha sido un regalo para mi marido. Una escapada de 4 días muy bien aprovechados. Visita a Toledo. Entradas al teatro más noche madrileña. Entradas al campo Civitas Metropolitano para disfrutar de un partidazo Atlético de Madrid-Sevilla. Entradas para disfrutar de un monólogo. Visiteo de la ciudad y por supuesto disfrute de la gastronomía madrileña.,Bob W Madrid Arte,122,5.0,"Calle Fray Luis de León, 18, 28012, Madrid",Palos de Moguer,40.4048492,-3.6987338,POINT (-3.6987338 40.4048492),0,0,0,0,0,0,0,0,0,0,0,0,0,0,0,0,0,0,0,0,0,0,0,0,0,0,0,0,0,0,0,0,0,0,0,0,0,0,0,0,0,0,0,0,0,0,0,0,0,0,0,0,0,0,0,0,0,0,0,0,0,0,0,0,0,0,0,0,0,0,0,0,0,0,0,0,0,0,0,0,0,0,0,0,0,0,0,0,0,0,0,0,0,0,0,0,0,0,0,0,0,0,0,0,0,0,0,0,0,0,0,0,0,0,0,0,0,0,0,0,0,0,0,0,0,1,0,0,0,0,0,0,0,0,0,0,0,0,0,0,0,0,0,0,0,0,0,0,0,0,0,0,0,0,0,0,0,0,0,0,0,0,0,0,0,0,0,0,0,0,0,0,0,0,0,0,0,0,0,0,0,0,0,1,0
341,"Descubre por qué tantos viajeros ven Hotel Ateneo Puerta del Sol como el hotel ideal cuando visitan Madrid. Además de aportar la combinación ideal de calidad, comodidad y ubicación, ofrece una amplia variedad de servicios diseñados para viajeros como tú.
Hotel Ateneo Puerta del Sol es un hotel con televisor de pantalla plana, aire acondicionado y frigorífico en las habitaciones, y es fácil permanecer conectado durante la estancia, ya que ofrece wifi gratuito para los huéspedes.",Hotel Ateneo Puerta del Sol,127,4.0,"Calle Montera, 22, 28013, Madrid",Sol,40.41819035,-3.702315219613487,POINT (-3.702315219613487 40.41819035),0,1,0,0,0,0,1,0,0,1,0,0,0,0,1,0,0,0,0,0,0,0,0,0,0,0,0,0,0,1,0,0,0,0,0,1,1,1,0,1,0,0,0,0,0,0,0,0,0,0,0,0,0,0,0,0,0,0,0,0,0,0,0,0,0,0,0,0,0,0,0,0,0,1,0,0,0,0,0,1,0,0,0,0,0,0,0,0,0,0,0,0,0,0,0,1,0,0,0,0,0,0,0,0,0,0,0,0,0,0,0,0,0,0,0,0,0,0,0,0,0,0,0,0,0,0,0,0,0,0,0,0,0,0,0,0,0,0,0,0,0,0,0,0,0,0,0,0,0,0,0,0,0,0,0,0,0,0,0,0,0,0,0,0,0,0,0,0,0,0,0,0,0,0,1,0,0,0,0,0,0,0,0,0,0
342,"Pequeño alojamiento en el corazón de Madrid, a 150 metros de Puerta del Sol y Plaza Mayor. Habitaciones con baño privado, aire acondicionado, frigorífico, Wi-fi,etc.",Hostal Adriano,117,4.0,"Calle de la Cruz, 26, 28012, Madrid",Embajadores,40.4148442,-3.7027669,POINT (-3.7027669 40.4148442),0,1,0,0,0,0,0,0,0,1,0,0,0,0,1,1,0,0,0,0,0,0,0,0,0,0,0,0,1,1,0,0,0,0,0,1,0,1,0,1,0,0,0,1,1,0,0,0,0,0,0,0,0,0,0,0,0,0,0,0,0,0,0,0,0,0,0,0,0,0,0,0,0,1,0,0,1,0,0,0,0,0,0,0,0,0,0,0,0,0,0,0,0,0,0,0,0,0,0,0,0,0,0,0,0,0,0,0,0,0,0,0,0,0,0,0,0,0,0,0,0,0,0,0,0,0,0,0,0,0,0,0,0,0,0,0,0,0,0,0,0,0,0,0,0,0,0,0,0,0,0,0,0,0,0,0,0,0,0,0,0,0,0,0,0,0,0,0,0,0,0,0,0,0,1,0,0,0,0,0,0,0,0,0,0
343,"En el Hotel Freedom te ofrecemos un trato familiar y cercano, somos un Hotel Boutique donde nuestra prioridad es tu satisfacción. Todo nuestro equipo trabajará para que puedas sentir la libertad de Madrid en la suavidad de una cama.",Hotel Freedom,80,4.0,"Calle de Santa Isabel, 4, 28012, Madrid",Embajadores,40.412117,-3.6995859,POINT (-3.6995859 40.412117),0,1,0,1,0,0,0,0,0,1,0,1,1,0,0,0,0,0,0,0,0,0,0,0,0,0,0,0,0,0,0,0,0,0,0,0,0,0,0,0,0,0,0,0,0,0,0,0,0,0,0,0,0,0,0,0,0,0,0,0,0,0,0,0,0,0,0,0,0,0,0,0,0,0,0,0,0,0,0,0,0,0,0,0,0,0,0,0,0,0,0,0,1,0,0,0,0,0,0,0,0,0,0,0,0,0,0,0,0,0,0,0,0,0,0,0,0,0,0,0,0,0,0,0,0,0,0,0,0,0,0,0,0,0,0,0,0,0,0,0,0,0,0,0,0,0,0,0,0,0,0,0,0,0,0,0,0,0,0,0,0,0,0,0,0,0,0,0,0,0,0,0,0,0,1,0,0,0,1,0,0,0,0,0,0
344,"El Hostal Olmedo en Madrid le ofrece un ambiente acogedor, un trato agradable y el punto de partida ideal para disfrutar de unos días de vacaciones en Madrid. Nos encontramos junto a la Puerta del Sol, a un paso de lugares tan emblemáticos como la Gran Vía, Ópera, Callao o la Plaza Mayor. Además de una magnífica ubicación, en el hostal encontrará la tranquilidad necesaria para descansar y desconectar de la rutina.
El Hostal Olmedo se encuentra en la 4º planta de la C/Victoria 8. El edificio NO dispone de ascensor. El check in se lleva a cabo en el HOSTAL MARLASCA, situado en el edificio de al lado.",Hostal Olmedo,42,3.5,"Calle Victoria, 8, 28012, Madrid",Sol,40.4157768,-3.7017696,POINT (-3.7017696 40.4157768),0,1,0,0,0,0,0,0,0,1,0,0,0,0,1,1,0,0,0,0,0,0,0,0,0,0,0,0,0,0,0,0,0,0,0,0,0,0,0,1,0,0,0,0,0,0,0,0,0,0,0,0,0,0,0,0,0,0,0,0,0,0,0,0,0,0,0,0,0,0,0,0,0,1,0,0,1,0,0,0,0,0,0,0,0,0,0,0,0,0,0,0,0,0,0,0,0,0,0,0,0,0,0,0,0,0,0,0,0,0,0,0,0,0,0,0,0,0,0,0,0,0,0,0,0,0,0,0,0,0,0,0,0,0,0,0,0,0,0,0,0,0,0,0,0,0,0,0,0,0,0,0,0,0,0,0,0,0,0,0,0,0,0,0,0,0,0,0,0,0,0,0,0,0,1,0,0,0,1,0,0,0,0,0,0
345,"Jc Rooms Santa Ana ubicado a escasos 50 metros de la Puerta del Sol ofrece a sus clientes la posibilidad de alojarse en habitaciones tematicas ambientades en las regiones mas emblematicas de España. Todo ello de la mano de una gran variedad de servicios tanto en las habitaciones( Minibar Gratuito con reposicion diaria,Ordenador con internet en cada habitacion Gartis,caja fuerte...) como fuera de ella (Tour gratuito guiado,invitaciones en los bares,restaurantes y pubs de mas ambiente de Madrid...) Sin duda la mejor opcion para alojarse en el centro de Madrid a precios muy economicos y con los mejores sevicios.",JC Rooms Santa Ana,52,4.0,"Calle Cruz, 8, 28012, Madrid",Barrio no encontrado,40.6247479,-4.009077162849231,POINT (-4.009077162849231 40.6247479),0,1,0,0,0,0,0,0,0,1,0,1,0,0,1,0,0,0,0,0,1,0,0,0,0,0,0,0,0,0,0,0,0,0,0,1,0,1,0,1,0,0,0,0,0,0,0,0,0,0,0,0,0,0,0,0,0,0,0,0,0,0,0,0,0,0,0,0,0,0,0,0,0,1,0,0,1,0,0,0,0,0,0,0,0,0,0,0,0,0,0,0,0,0,0,0,0,0,0,0,0,0,0,0,0,0,0,0,0,0,0,0,0,0,0,0,0,0,0,0,0,0,0,0,0,0,0,0,0,0,0,0,0,0,0,0,0,0,0,0,0,0,0,0,0,0,0,0,0,0,0,0,0,0,0,0,0,0,0,0,0,0,0,0,0,0,0,0,0,0,0,0,0,0,1,0,0,0,0,0,0,0,0,0,0
346,"Ofrece alojamientos con aire acondicionado, calefacción y conexión WiFi gratuita. Los apartamentos y los estudios están equipados con TV de pantalla plana y cocina con lavadora, fogones y microondas. También hay utensilios de cocina. Todos los apartamentos disponen de baño privado con secador de pelo y artículos de aseo gratuitos. Las toallas y la ropa de cama están incluidas. Los apartamentos gozan de una ubicación céntrica, a pocos pasos de varios bares y restaurantes, así como de muchos lugares de interés de Madrid. El Museo del Prado está a 10 minutos a pie y el parque del Retiro, a 1 km. La estación de tren Puerta de Atocha queda a 13 minutos andando.",Good Stay Atocha,50,3.0,"Calle Buenavista, 4, 28012, Madrid",Barrio no encontrado,40.58066735,-3.89199631227228,POINT (-3.89199631227228 40.58066735),0,1,0,0,0,0,0,0,0,1,0,0,0,1,1,1,0,0,0,0,0,0,0,0,0,0,0,0,0,0,0,0,0,0,0,0,0,0,0,0,0,0,0,0,1,0,0,0,0,0,0,1,0,0,0,0,0,0,0,0,0,0,0,0,0,0,0,1,0,0,0,0,0,1,0,0,1,0,0,0,0,0,0,1,0,0,0,0,0,0,0,0,0,0,0,0,0,0,0,0,0,0,0,0,0,0,0,1,1,0,0,0,0,0,0,0,0,0,0,0,0,0,0,1,0,0,0,0,0,0,0,0,0,0,0,0,0,0,0,0,0,0,0,0,0,0,0,0,0,0,0,0,0,0,0,0,0,0,1,0,0,0,0,0,0,0,0,0,0,0,0,0,0,0,1,0,0,0,1,0,0,0,0,0,0
347,El CH Otello Rooms I - Madrid se encuentra a 100 metros de la estación de metro de Ópera y ofrece habitaciones con WiFi gratuita y baño privado. En el hostal hay un salón compartido.,CH Otello Rooms,59,3.5,"Calle de Campomanes, 6, 28013, Madrid",Palacio,40.419015,-3.7092183,POINT (-3.7092183 40.419015),0,1,0,0,0,0,0,0,0,1,0,0,0,0,0,0,0,0,0,0,0,0,0,0,0,0,0,0,0,0,0,0,0,0,0,1,0,0,0,0,0,0,0,0,0,0,0,0,0,0,0,0,0,0,0,0,0,0,0,0,0,0,0,0,0,0,0,0,0,0,0,0,0,1,0,0,1,0,0,1,0,0,0,0,0,0,0,0,0,0,0,0,0,0,0,0,0,0,0,0,0,0,0,0,0,0,0,0,0,0,0,0,0,0,0,0,0,0,0,0,0,0,0,0,0,0,0,0,0,0,0,0,0,0,0,0,1,0,0,0,0,0,0,0,0,0,0,0,0,0,0,0,0,0,0,0,0,0,0,0,0,0,0,0,0,0,0,0,0,0,0,0,0,0,0,0,0,0,0,0,0,0,0,1,0
