505,"Una habitación pequeña y un baño pequeño, pero la cama y los cojines eran de hotel de 5 estrellas, era muy cómodos. Mejor unbicación con ese precio es imposible, ya que estás a un paso de todo. Lo recomendamos, siempre y cuando solo sea para dormir y ducharse y no para pasar tiempo allí.",New Go Inn,87,3.0,"Calle de la Libertad, 4, 28004, Madrid",Cortes,40.4203679,-3.697312,POINT (-3.697312 40.4203679),0,0,0,0,0,0,0,0,0,0,0,0,0,0,0,0,0,0,0,0,0,0,0,0,0,0,0,0,0,0,0,0,0,0,0,0,0,0,0,0,0,0,0,0,0,0,0,0,0,0,0,0,0,0,0,0,0,0,0,0,0,0,0,0,0,0,0,0,0,0,0,0,0,0,0,0,0,0,0,0,0,0,0,0,0,0,0,0,0,0,0,0,0,0,0,0,0,0,0,0,0,0,0,0,0,0,0,0,0,0,0,0,0,0,0,0,0,0,0,0,0,0,0,0,0,1,0,0,0,0,0,0,0,0,0,0,0,0,0,0,0,0,0,0,0,0,0,0,0,0,0,0,0,0,0,0,0,0,0,0,0,0,0,0,0,0,0,0,0,0,0,0,0,0,0,0,0,0,0,0,0,0,0,1,0
506,"Somos un grupo de amigos que hemos pasado una noche en este alojamiento. Primero, es complicado de encontrar porque no tiene ninguna placa que lo identifiquen como hostal, pero a su favor dire es fácil aparcar en la calle. La habitación era muy amplia, estaba muy limpia con vistas a la piscina, la cual permanece abierta toda la noche. La única pega, que en pleno agosto nos hizo falta el aire acondicionado del cual carece.",Casa Nordia,82,3.5,"Calle Conde de Las Posadas, 13, 28042, Madrid",Palomas,40.4543803,-3.612652844983937,POINT (-3.612652844983937 40.4543803),0,1,0,0,0,0,0,0,0,0,0,1,0,0,0,0,0,0,0,0,0,0,0,0,1,1,0,0,0,0,0,0,0,0,0,1,0,0,0,0,0,1,0,0,0,0,0,0,0,0,0,0,0,0,0,0,0,0,0,0,0,0,0,0,0,0,0,0,0,0,0,0,0,0,0,0,0,0,0,0,0,0,0,0,0,0,0,0,0,0,0,0,0,0,0,0,0,0,0,0,0,0,0,0,0,0,0,0,0,0,0,0,0,0,0,0,0,0,0,0,0,1,0,0,1,0,0,0,0,0,0,0,0,0,0,0,0,0,0,0,0,0,0,0,0,0,0,0,0,0,0,0,0,0,0,0,0,0,0,0,0,0,0,0,0,0,0,1,1,0,0,0,0,0,0,0,0,0,1,0,0,0,0,0,0
507,"Una estancia fenomenal. El apartamento tiene una ubicación idónea, la limpieza es un 10, y el servicio maravilloso (como siempre). ¡Me trajeron a las 8 am un cargador para que pudiera cargar mi teléfono antes de llegar coger el ave de regreso a mi ciudad! Una atención de lo más profesional.",Be Mate Gran Via Suites,108,4.0,"Calle de los Jardines, 11, 28013, Madrid",Sol,40.4189624,-3.7009097,POINT (-3.7009097 40.4189624),0,0,0,0,0,0,0,0,0,1,0,0,0,0,1,1,0,0,0,0,0,0,0,0,0,0,0,0,0,1,0,0,0,0,0,0,0,0,0,0,0,0,0,0,0,0,0,0,0,0,0,0,0,0,0,0,0,0,0,0,0,0,1,0,0,0,0,0,1,0,0,0,0,1,0,1,0,1,0,0,0,0,0,0,0,0,0,0,0,0,0,0,0,0,0,0,0,0,0,0,0,0,0,0,0,0,0,0,0,0,0,0,0,0,0,0,0,0,0,0,0,0,0,1,0,0,0,0,0,0,0,0,0,0,0,0,0,0,0,0,0,0,0,0,0,0,0,0,0,0,0,0,0,0,0,0,0,0,0,0,0,0,0,0,0,0,0,0,0,1,0,0,0,0,0,1,0,0,0,0,0,0,0,0,0
508,"""Aspasios Calle Mayor Apartments"" es un Apartment Hotel situado en un barrio muy céntrico, junto a la famosa Plaza Mayor. La recepción en la planta baja está abierta de 9:00 a 18:00. Los apartamentos están en un edificio recientemente renovado y que vienen equipados con todas las comodidades que necesitarás para una estancia perfecta.",Aspasios Calle Mayor Apartments,209,4.5,"Calle Mayor, 28013, Madrid",Sol,40.4162892,-3.7067907,POINT (-3.7067907 40.4162892),0,1,0,0,1,0,0,0,0,1,0,0,0,0,1,0,0,0,0,0,0,0,0,0,0,0,0,0,0,0,0,0,0,0,0,0,0,0,0,1,1,0,0,0,0,0,0,0,0,0,0,0,0,0,0,0,0,0,0,0,0,0,1,0,0,0,0,1,0,0,0,0,0,1,0,0,1,0,0,0,0,0,0,0,0,0,0,0,0,0,0,0,0,0,0,0,0,0,0,0,0,0,0,0,0,0,0,0,0,0,0,0,0,0,0,0,0,0,0,1,0,0,0,0,0,0,0,0,0,0,0,0,0,0,0,0,0,0,0,0,0,0,0,0,0,0,0,0,0,0,0,0,0,0,0,0,0,0,1,0,0,0,0,0,0,0,0,0,0,0,0,0,0,0,1,0,0,0,0,0,0,0,0,0,0
509,"La búsqueda del hotel pequeño económico ideal en Madrid no tiene por qué ser difícil. Bienvenido a Hostal Prim, una fantástica opción para viajeros como tú.
Las habitaciones de Hotel Hostal Prim ofrecen frigorífico y aire acondicionado, y los huéspedes pueden estar conectados con wifi gratuito.
Además, durante la estancia en Hostal Prim los huéspedes tienen acceso a recepción abierta 24 horas.",Hostal Prim,90,3.5,"Calle de Prim, 15, 28004, Madrid",Justicia,40.4220247,-3.6933366,POINT (-3.6933366 40.4220247),0,1,0,0,0,0,0,0,0,1,0,1,0,0,0,0,0,0,0,0,0,0,0,0,0,0,0,0,0,1,0,0,0,0,0,0,0,1,0,1,0,0,0,0,0,0,0,0,0,0,0,0,0,0,0,0,0,0,0,0,0,0,0,0,0,0,0,0,0,0,0,0,0,1,0,0,1,0,0,0,0,0,0,0,0,0,0,0,0,0,0,0,0,0,0,0,0,0,0,0,0,0,0,0,0,0,0,0,0,0,0,0,0,0,0,0,0,0,0,0,0,0,0,0,0,0,0,0,0,0,0,0,0,0,0,0,0,0,0,0,0,0,0,0,0,0,0,0,0,0,0,0,0,0,0,0,0,0,0,0,0,0,0,0,0,0,0,0,0,0,0,0,0,0,1,0,0,0,0,0,0,0,0,0,0
510,"Como parte de nuestras vacaciones familiares estuvimos dos noches en Madrid y nos quedamos en este apartamento. Excelente lugar, espacioso, limpio, con todas las facilidades, muy céntrico y accesible a las áreas turísticas. Recomiendo este lugar 100%!!",Behap Madrid Plaza del Carmen,133,4.5,"Calle de Tetuán, 36, 28013, Madrid",Sol,40.4182364,-3.7030981,POINT (-3.7030981 40.4182364),0,0,0,0,0,0,0,0,0,0,0,0,0,0,0,0,0,0,0,0,0,0,0,0,0,0,0,0,0,0,0,0,0,0,0,0,0,0,0,0,0,0,0,0,0,0,0,0,0,0,0,0,0,0,0,0,0,0,0,0,0,0,0,0,0,0,0,0,0,0,0,0,0,0,0,0,0,0,0,0,0,0,0,0,0,0,0,0,0,0,0,0,0,0,0,0,0,0,0,0,0,0,0,0,0,0,0,0,0,0,0,0,0,0,0,0,0,0,0,0,0,0,0,0,0,1,0,0,0,0,0,0,0,0,0,0,0,0,0,0,0,0,0,0,0,0,0,0,0,0,0,0,0,0,0,0,0,0,0,0,0,0,0,0,0,0,0,0,0,0,0,0,0,0,0,0,0,0,0,0,0,0,0,1,0
511,"Muy buena relación calidad precio, todo súper limpio e inmejorable ubicación. A tiro de piedra de la Puerta del Sol y varias paradas de Metro. Camas y almohadas super cómodas, hay ascensor. Un sitio para alojarse si estás pocos días por Madrid.",Hostal PETITE MAMAN,77,3.5,"Calle del Príncipe, 18, 28012, Madrid",Cortes,40.4153135,-3.7003644,POINT (-3.7003644 40.4153135),0,0,0,0,0,0,0,0,0,0,0,0,0,0,0,0,0,0,0,0,0,0,0,0,0,0,0,0,0,0,0,0,0,0,0,0,0,0,0,0,0,0,0,0,0,0,0,0,0,0,0,0,0,0,0,0,0,0,0,0,0,0,0,0,0,0,0,0,0,0,0,0,0,0,0,0,0,0,0,0,0,0,0,0,0,0,0,0,0,0,0,0,0,0,0,0,0,0,0,0,0,0,0,0,0,0,0,0,0,0,0,0,0,0,0,0,0,0,0,0,0,0,0,0,0,1,0,0,0,0,0,0,0,0,0,0,0,0,0,0,0,0,0,0,0,0,0,0,0,0,0,0,0,0,0,0,0,0,0,0,0,0,0,0,0,0,0,0,0,0,0,0,0,0,0,0,0,0,0,0,0,0,0,1,0
512,"PERFECTO! Fabuloso hostal en pleno centro de Madrid, habitación grande con ducha perfecta, y televisión gigante. Se ve que está reformado. Nos tocó una habitación que daba a un patio con lo cual era muy silenciosa. No hay recepción 24 horas, pero las chicas que hay en horario de recepción son super amables y te explican todo bien. Sin lugar a dudas volveríamos sin pensarlo.",Woohoo Rooms Fuencarral,123,4.0,"Calle de Fuencarral, 41, 28004, Madrid",Universidad,40.4228124,-3.7008949,POINT (-3.7008949 40.4228124),0,0,0,0,0,0,0,0,0,0,0,0,0,0,0,0,0,0,0,0,0,0,0,0,0,0,0,0,0,0,0,0,0,0,0,0,0,0,0,0,0,0,0,0,0,0,0,0,0,0,0,0,0,0,0,0,0,0,0,0,0,0,0,0,0,0,0,0,0,0,0,0,0,0,0,0,0,0,0,0,0,0,0,0,0,0,0,0,0,0,0,0,0,0,0,0,0,0,0,0,0,0,0,0,0,0,0,0,0,0,0,0,0,0,0,0,0,0,0,0,0,0,0,0,0,1,0,0,0,0,0,0,0,0,0,0,0,0,0,0,0,0,0,0,0,0,0,0,0,0,0,0,0,0,0,0,0,0,0,0,0,0,0,0,0,0,0,0,0,0,0,0,0,0,0,0,0,0,0,0,0,0,0,1,0
513,"Descubre por qué tantos viajeros ven Oriente Suites como el hotel ideal cuando visitan Madrid. Además de aportar la combinación ideal de calidad, comodidad y ubicación, ofrece una amplia variedad de servicios diseñados para viajeros como tú.
Las habitaciones de los huéspedes incluyen televisor de pantalla plana, aire acondicionado y frigorífico.
Los puntos de referencia que hay por los alrededores, como Plaza Mayor (0,2 km) y Sobrino de Botín (0,4 km) hacen de Oriente Suites un magnífico sitio donde alojarse en Madrid.",Oriente Suites,132,4.5,"Calle Escalinata, 4, 28013, Madrid",Barrio no encontrado,40.6415984,-3.9956578890673264,POINT (-3.9956578890673264 40.6415984),0,0,0,0,1,0,0,0,0,1,0,0,0,1,1,0,0,0,0,0,0,0,0,0,0,0,0,0,0,0,0,0,0,0,0,0,0,0,0,0,0,0,0,1,1,0,0,0,0,0,0,0,0,0,0,0,0,0,0,0,0,0,1,0,0,0,0,0,0,0,0,0,0,0,0,0,0,0,0,0,0,0,0,0,0,0,0,0,0,0,0,0,0,0,0,0,0,0,0,0,0,0,0,0,0,0,0,0,0,0,0,0,0,0,0,0,0,0,0,1,0,0,0,1,0,0,0,0,0,0,0,0,0,0,0,0,0,0,0,0,0,0,0,0,0,0,0,0,0,0,0,0,0,0,0,0,0,0,0,0,0,0,0,0,0,0,0,0,0,0,0,0,0,0,0,1,1,0,0,0,0,0,0,0,0
514,"Descubre por qué tantos viajeros ven Hostal R. Fernandez como el hotel pequeño ideal cuando visitan Madrid. Además de aportar la combinación ideal de calidad, comodidad y ubicación, ofrece un ambiente romántico con una amplia variedad de servicios diseñados para viajeros como tú.
Los puntos de referencia de los alrededores, como Plaza de Santa Ana (0,2 km) y Plaza Mayor (0,7 km) hacen de Hostal R. Fernandez un magnífico sitio donde alojarse durante un viaje a Madrid.",Hostal R. Fernandez,70,3.5,"Calle de León, 10, 28014, Madrid",Barrio no encontrado,40.48755095,-3.341192309328358,POINT (-3.341192309328358 40.48755095),0,1,0,0,0,0,0,0,0,1,1,0,0,0,1,0,0,0,0,0,0,0,0,0,0,0,0,0,0,0,0,1,0,0,0,1,1,1,0,1,1,0,0,0,0,1,0,0,0,1,0,1,0,0,0,0,0,0,0,0,0,0,0,0,0,0,0,0,0,0,0,0,0,0,0,0,0,0,0,0,1,0,0,0,0,0,0,0,0,0,0,0,0,0,0,0,1,0,0,0,0,0,0,0,0,0,0,0,1,0,0,0,0,0,0,0,0,0,0,0,0,0,0,0,0,0,0,0,0,0,0,0,0,0,0,0,0,0,0,0,0,0,0,0,0,0,0,0,0,0,0,0,0,0,0,0,0,0,0,0,0,0,0,0,0,0,0,0,0,0,0,0,0,0,1,0,0,0,0,0,0,0,0,0,0
515,"Situado en la calle principal de Madrid a 200 metros del parque del Retiro entre los dos símbolos de la villa de Madrid, la Puerta de Alcalá y la Fuente de la Cibeles, ofrece un alojamiento lujoso, elegante y confortable. Todas las suites cuentan con climatización individual, cocina completa, menaje, conexión Wi-Fi gratuita.Luxury Suites Madrid, ofrece una decoración contemporánea con suelos de tarima. Todas las suites disponen de un gran salón espacioso con 2 o 3 TV LED vía satélite. Las cocinas completas incluyen todos los electrodomésticos de última generación.El llamado Triángulo del Arte los museos de El Prado, Reina Sofía y Thyssen-Bornemisza se encuentran en los alrededores de Luxury Suites Madrid.",Luxury Suites,212,4.5,"Calle de Alcalá, 57, 28014, Madrid",Jerónimos,40.4198001,-3.6915135,POINT (-3.6915135 40.4198001),1,1,0,0,0,0,0,0,0,1,0,1,0,1,1,0,0,0,0,0,0,0,1,0,0,0,1,0,0,0,0,1,1,0,0,1,0,0,0,0,0,0,0,0,0,0,0,0,0,0,0,0,0,0,0,1,0,0,0,0,0,0,0,0,0,0,0,0,0,0,0,0,0,0,0,0,0,0,0,0,0,0,0,0,0,0,0,0,0,0,1,0,0,1,0,0,0,0,0,0,0,0,0,0,0,0,0,0,0,0,0,0,0,0,1,0,0,0,0,0,0,0,0,0,0,0,0,0,0,0,0,0,0,0,0,0,0,0,0,0,0,0,0,0,0,0,0,0,0,0,0,0,0,0,0,0,0,0,0,0,0,0,0,0,0,0,0,0,0,0,0,0,0,0,1,1,1,1,1,0,1,0,0,0,0
516,Estos elegantes y modernos apartamentos están ubicados en una tranquila calle del distrito financiero de Madrid. Podrá llegar a las plazas históricas del centro en sólo 10 minutos.,Apartamentos Salvia 4,93,4.0,"Calle Salvia, 4, 28039, Madrid",Valdeacederas,40.4631844,-3.698639971894648,POINT (-3.698639971894648 40.4631844),0,1,0,0,1,0,0,0,0,1,0,0,0,1,1,1,0,0,0,0,0,0,0,0,0,0,0,0,0,0,1,0,0,0,0,0,0,0,0,0,0,0,0,0,1,0,0,0,0,0,0,0,0,0,0,0,0,0,0,0,0,0,0,0,0,0,0,1,1,0,0,0,0,0,0,0,1,0,0,0,0,0,0,1,0,0,0,0,0,0,0,0,0,0,0,0,0,0,0,0,0,0,0,0,0,0,0,0,1,0,0,0,0,0,0,0,0,0,0,0,0,0,0,0,0,0,0,0,0,0,0,0,0,0,0,0,0,0,0,0,0,0,0,0,0,0,0,0,0,0,0,0,0,0,0,0,0,0,0,0,0,0,0,0,0,0,0,0,0,0,0,0,0,0,0,0,0,0,1,0,0,0,0,0,0
517,"Si estas buscando un alojamiento en la Gran Vía para conocer Madrid, el Hostal la Plata es la mejor opción para tu estancia en la capital. En nuestro hostal disponemos de 19 habitaciones: individuales, dobles, triples y con cama de matrimonio, todas ellas disponen de cuarto de baño privado con plato de ducha, TV y TDT, Caja de seguridad, Aire acondicionado con frío / calor, calefacción, conexión a internet con WiFi gratuita, etc…. Y disponemos una terraza desde la que podrás disfrutar de unas excelentes vistas aéreas de las inmediaciones. La preocupación por los detalles, un servicio impecable, así como el trato cercano y de calidad, es la identidad de todos los servicios de nuestro Hostal, seguimos trabajando constantemente para mantener un nivel de calidad óptimo con el que conseguir la máxima satisfacción de nuestros clientes. El Hostal se ubica en la cuarta planta del número 15 de la calle, en un edificio modernista construido entre los años 1918 y 1921.",GoodRooms,65,4.0,"Calle Gran Vía, 15, 28013, Madrid",Barrio no encontrado,40.4725992,-3.8717231,POINT (-3.8717231 40.4725992),1,1,0,0,0,0,0,0,0,1,1,0,0,0,1,0,0,0,0,0,0,0,0,0,0,0,0,0,0,0,0,0,0,0,0,1,1,0,0,1,0,0,0,0,1,0,0,0,0,0,0,0,0,0,0,0,0,0,0,0,0,1,0,0,0,0,0,0,0,0,0,0,0,1,0,0,0,0,1,0,0,0,0,0,0,0,0,0,0,0,0,0,0,0,0,0,0,0,0,0,0,0,0,0,0,0,0,0,1,0,0,0,0,0,0,0,0,0,0,0,0,0,0,0,0,0,0,0,0,0,0,0,0,0,0,0,0,0,0,0,0,0,1,0,0,0,0,0,0,0,0,0,0,0,0,0,0,0,0,0,0,1,0,0,0,0,0,0,0,0,0,0,0,0,0,0,0,0,0,0,0,0,0,1,0
518,Gran Via Suites Madrid son unos modernos y lujosos apartamentos ubicados a escasos metros de la Gran Via madrilena. Cuentan con todo tipo de comodidades asi como varias habitaciones para que puedan alojarse desde parejas a grupos mas grandes. Incluyen el uso y disfrute de la cocina de cada apartamento totalmente equipada y wifi gratuito para todos los apartamentos,Gran Vía Suites,112,4.0,"Calle de Victor Hugo, 4, 28004, Madrid",Cortes,40.4200551,-3.6980658,POINT (-3.6980658 40.4200551),0,1,0,0,0,0,0,0,0,1,0,0,0,0,1,0,1,0,0,0,0,0,0,0,0,0,0,0,0,1,0,0,0,0,0,0,0,0,0,0,0,0,0,0,0,0,0,0,0,0,0,0,0,0,0,0,0,0,0,0,0,0,1,0,0,0,0,1,1,0,0,0,0,1,0,0,1,0,0,0,0,0,0,0,0,0,0,0,0,0,0,0,0,0,0,0,0,0,0,0,0,0,0,0,0,0,0,0,1,0,0,0,0,0,0,0,0,0,0,0,0,0,0,1,0,0,0,0,0,0,0,0,0,0,0,0,0,0,0,0,0,0,0,0,0,0,0,0,0,0,0,0,0,0,0,0,0,0,0,0,0,0,0,0,0,0,0,0,0,0,1,0,0,0,1,0,0,0,0,0,0,0,0,0,0
519,"La Pensión Navarra está situada en una zona tranquila del barrio de Tetuán, en el centro de Madrid, a solo 140 metros de la estación de metro de Estrecho. Ofrece servicio de recepción las 24 horas.",Navarra Pension,51,3.5,"Calle Navarra, 16, 28039, Madrid",Bellas Vistas,40.4536229,-3.7040603,POINT (-3.7040603 40.4536229),0,1,0,0,0,0,0,0,0,1,0,0,1,0,0,0,0,0,0,0,0,0,0,0,0,0,0,0,0,0,0,0,0,0,0,1,0,0,0,0,0,0,0,0,0,0,0,0,0,0,0,0,0,0,0,0,0,0,0,0,0,0,0,0,0,0,0,0,0,0,0,0,0,0,0,0,1,0,0,1,0,0,0,0,0,0,0,0,0,0,0,0,0,0,0,0,0,0,1,0,0,0,0,0,0,0,0,0,0,0,0,0,0,0,0,0,0,0,0,0,0,0,0,0,1,0,0,0,0,0,0,0,0,0,0,0,0,0,0,0,0,0,0,0,0,0,0,0,0,0,0,0,0,0,0,0,0,0,0,0,0,0,0,0,0,0,0,0,0,0,0,0,0,0,0,0,0,0,0,0,0,0,0,1,0
520,Se trata de un establecimiento muy cerca de IFEMA y el aeropuerto de Madrid. Ofrecemos altos estandares de limpieza y trato personalizado a un buen precio . Hay distinta categoria de habitaciones que se adaptan a los distintos presupuestos. Se puede estacionar gratuitamente en las inmediaciones y viajar al centro de Madrid cómodamente en transporte publico.,Escala Suites,87,3.5,"Calle Conde de las Posadas, 13, 28042, Madrid",Palomas,40.4543803,-3.612652844983937,POINT (-3.612652844983937 40.4543803),0,1,0,1,1,0,0,0,0,1,0,0,0,0,0,0,0,0,0,0,0,0,0,0,1,0,0,0,0,0,0,0,0,0,0,0,0,0,0,0,0,1,0,0,0,0,0,0,0,0,0,0,0,0,1,0,0,0,0,0,0,0,0,0,0,0,0,0,0,0,0,0,0,0,0,0,0,0,0,0,0,0,0,0,0,1,0,0,0,0,0,0,0,0,0,0,0,0,0,0,0,0,0,0,0,0,0,0,0,0,0,0,0,0,0,0,0,0,0,0,0,0,0,0,0,0,0,0,0,0,0,0,0,0,0,0,0,0,0,0,0,0,0,0,0,0,0,0,0,0,0,0,0,0,0,0,0,0,0,0,0,0,0,0,0,0,0,0,0,0,0,1,0,0,0,0,0,0,0,0,0,0,0,1,0
521,"El Uma Suites O'Donnell se encuentra en Madrid, a 2,8 km del Museo Thyssen-Bornemisza, y ofrece alojamiento con aire acondicionado, WiFi gratuita y acceso a un solárium. El apartamento ofrece balcón, vistas a la ciudad, zona de estar, TV de pantalla plana, cocina totalmente equipada con nevera y baño privado con ducha y secador de pelo. El Uma Suites O'Donnell se encuentra a 1,6 km del parque del Retiro y a 3,1 km de la estación de metro Gran Vía. El aeropuerto Adolfo Suárez Madrid-Barajas es el más cercano y queda a 11 km.",Uma Suites O'Donnell,157,5.0,"Calle Doctor Esquerdo, 77, 28007, Madrid",Niño Jesús,40.4083645,-3.6701689,POINT (-3.6701689 40.4083645),1,1,0,0,0,0,0,0,0,1,1,0,0,1,1,1,0,0,0,1,0,0,0,0,0,1,0,0,0,0,0,0,0,1,0,1,0,0,0,0,0,0,0,0,0,0,1,0,0,0,0,0,0,0,0,1,0,0,0,0,0,0,0,0,0,0,0,0,0,0,0,0,0,0,0,0,0,0,0,0,0,0,0,0,0,0,0,0,0,0,0,0,0,0,0,0,0,0,0,0,0,0,0,0,0,0,0,1,0,0,0,0,0,0,0,0,0,0,0,0,0,0,0,0,0,0,0,0,0,0,0,0,0,0,0,0,0,0,0,0,0,0,0,0,0,0,0,1,0,0,0,0,0,0,0,0,0,0,0,0,0,0,0,0,0,0,1,0,0,0,0,0,0,0,1,0,0,1,1,0,0,0,0,0,0
522,"Hotel boutique. Personal amable y servicial. Bien equipado. hermoso edificio Amplio apartamento. Us�� el gimnasio, el spa y la sauna todos los d��as; necesito reservar con anticipaci��n. El ��nico inconveniente: no hay opci��n para comer en el lugar. Sin embargo, muchas opciones directamente afuera. Buena ubicaci��n. 50 metros al metro. Supermercado a 100 metros. A poca distancia del centro de la ciudad. Me quedar��a de nuevo sin dudarlo.",Palacio Tirso De Molina,340,5.0,"Plaza Tirso de Molina, 8, 28012, Madrid",Barrio no encontrado,40.30438755,-3.7373042719728495,POINT (-3.7373042719728495 40.30438755),0,0,0,0,0,0,0,0,0,0,0,0,0,0,0,0,0,0,0,0,0,0,0,0,0,0,0,0,0,0,0,0,0,0,0,0,0,0,0,0,0,0,0,0,0,0,0,0,0,0,0,0,0,0,0,0,0,0,0,0,0,0,0,0,0,0,0,0,0,0,0,0,0,0,0,0,0,0,0,0,0,0,0,0,0,0,0,0,0,0,0,0,0,0,0,0,0,0,0,0,0,0,0,0,0,0,0,0,0,0,0,0,0,0,0,0,0,0,0,0,0,0,0,0,0,1,0,0,0,0,0,0,0,0,0,0,0,0,0,0,0,0,0,0,0,0,0,0,0,0,0,0,0,0,0,0,0,0,0,0,0,0,0,0,0,0,0,0,0,0,0,0,0,0,0,0,0,0,0,0,0,0,0,1,0
523,"Los Apartamentos Moratín Las Letras ofrecen alojamiento bien equipado con WiFi gratuita en el centro de Madrid, a 1,2 km de la Plaza Mayor y a 700 metros del Museo Reina Sofía.",Apartamentos Moratin Las Letras,207,3.5,"Calle de Moratín, 11, 28014, Madrid",Embajadores,40.412403,-3.6974863321460782,POINT (-3.6974863321460782 40.412403),0,0,0,1,0,0,0,0,0,0,0,0,0,0,0,0,0,0,0,0,0,0,0,0,0,0,0,0,0,0,0,0,0,0,0,0,0,0,0,0,0,0,0,0,0,0,0,0,0,0,0,0,0,0,0,0,0,0,0,0,0,0,0,0,0,0,0,0,0,0,0,0,0,0,0,0,0,0,0,0,0,0,0,0,0,0,0,0,0,0,0,0,0,0,0,0,0,0,0,0,0,0,0,0,0,0,0,0,0,0,0,0,0,0,0,0,0,0,0,0,0,0,0,0,0,0,0,0,0,0,0,0,0,0,0,0,0,0,0,0,0,0,0,0,0,0,0,0,0,0,0,0,0,0,0,0,0,0,0,0,0,0,0,0,0,0,0,0,0,0,0,0,0,0,0,0,0,0,0,0,0,0,0,1,0
524,"Los Apartamentos Good Stay Madrid Prado se encuentran en pleno centro de Madrid, a 5 minutos a pie de la estación de tren de Atocha y del Museo del Prado. Estos apartamentos elegantes ocupan un edificio con ascensor y cuentan con lavadora. Además, se ofrece WiFi gratuita en las zonas comunes. Los modernos apartamentos disponen de zona de estar de planta abierta con TV de pantalla plana, camas con colchones de espuma viscoelástica y mesa de comedor con sillas. La zona de cocina está equipada con vitrocerámica, microondas y utensilios de cocina. El baño incluye ducha y secador de pelo. La calefacción y el aire acondicionado están disponibles de forma gratuita. Los Apartamentos Good Stay Madrid Prado se encuentran a unos 5 minutos a pie de varios bares, restaurantes y tiendas. La Puerta del Sol está situada a 15 minutos a pie. Desde la estación de Atocha se puede llegar en tren al aeropuerto de Barajas, situado a 15 km.",Good Stay Prado,81,3.5,"Calle San Pedro, 13, 28014, Madrid",Embajadores,40.4113745,-3.694716,POINT (-3.694716 40.4113745),0,1,0,0,0,0,0,0,0,1,0,1,0,0,0,0,0,0,0,0,0,0,0,0,0,1,0,0,0,1,0,0,0,0,0,0,0,0,0,0,0,0,0,0,0,0,0,0,0,0,0,0,0,0,0,0,0,0,0,0,0,0,0,0,0,0,0,1,1,0,0,0,0,1,0,0,1,0,0,0,0,0,0,0,0,0,0,0,0,0,0,0,0,0,0,0,0,0,0,0,0,0,0,0,0,0,0,0,0,0,0,0,0,0,0,0,0,0,0,0,0,0,0,0,1,0,0,0,0,0,0,0,0,0,0,0,0,0,0,0,0,0,0,0,0,0,0,0,0,0,0,0,0,0,0,0,0,0,0,0,0,0,0,0,0,0,0,0,0,0,0,0,0,0,1,0,0,0,1,0,0,0,0,0,0
525,"Hostal Romero es una magnífica elección para los viajeros que visiten Madrid, ya que ofrece un ambiente económico, además de numerosos servicios diseñados para mejorar tu estancia.
Durante su estancia en Hostal Romero, los huéspedes pueden visitar Plaza Mayor (0,7 km) y Malasaña (0,8 km), algunas de las principales atracciones de Madrid.
Las habitaciones de Hostal Romero ofrecen aire acondicionado, y mantenerse conectado es fácil, ya que hay wifi gratuito disponible.",Hostal Romero,55,4.0,"Calle Sierra de la Estrella, 5, 28053, Madrid",Barrio no encontrado,40.3085577,-3.4791592,POINT (-3.4791592 40.3085577),0,1,0,0,1,0,0,0,0,1,0,0,0,0,0,0,1,0,0,0,0,0,0,0,0,0,0,0,0,0,0,0,0,0,0,0,0,0,0,0,0,0,0,0,0,0,0,0,0,0,0,0,0,0,0,0,0,0,0,0,0,0,0,0,0,0,0,0,0,0,0,0,0,1,0,0,0,0,0,0,0,0,0,0,0,0,0,0,0,0,0,0,0,0,0,0,0,0,0,0,0,0,0,0,0,0,0,0,0,0,0,0,0,0,0,0,0,0,0,0,0,0,0,0,0,0,0,0,0,0,0,0,0,0,0,0,0,0,0,0,0,0,0,0,0,0,0,0,0,0,0,0,0,0,0,0,0,0,0,0,0,0,0,0,0,0,0,0,0,0,0,0,0,0,0,0,0,0,0,0,0,0,0,1,0
526,No disponible,Home Suite Home Alfonso Apartments,189,5.0,"Calle Fuencarral, 2, 28004, Madrid",Sol,40.4202273,-3.7015206,POINT (-3.7015206 40.4202273),0,0,0,0,0,0,0,0,0,0,0,0,0,0,0,0,0,0,0,0,0,0,0,0,0,0,0,0,0,0,0,0,0,0,0,0,0,0,0,0,0,0,0,0,0,0,0,0,0,0,0,0,0,0,0,0,0,0,0,0,0,0,0,0,0,0,0,0,0,0,0,0,0,0,0,0,0,0,0,0,0,0,0,0,0,0,0,0,0,0,0,0,0,0,0,0,0,0,0,0,0,0,0,0,0,0,0,0,0,0,0,0,0,0,0,0,0,0,0,0,0,0,0,0,0,1,0,0,0,0,0,0,0,0,0,0,0,0,0,0,0,0,0,0,0,0,0,0,0,0,0,0,0,0,0,0,0,0,0,0,0,0,0,0,0,0,0,0,0,0,0,0,0,0,0,0,0,0,0,0,0,0,0,1,0
527,"La Pensión Norte Oviedo es un alojamiento modesto, recatado situado en pleno centro de Madrid, a 140 metros de la Plaza de Chueca, 500 metros de Banco de España en la calle Alcalá y a otros 500 metros de la Plaza de Alonso Martínez. Ubicación privilegiada que te va a permitir moverte por la ciudad de una forma rápida y sencilla a pie, sin necesidad de utilizar medio de transporte. Norte Oviedo está totalmente reformado. Proporciona unas habitaciones acogedoras, bien iluminadas con vistas a patio interior o con balcón a la calle Piamonte, presentan una decoración bonita, sencilla y funcional. Las habitaciones son privadas y todas con baño privado. Este establecimiento ofrece una buena relación calidad precio, habitaciones modernas con calefacción, aire acondicionado, conexión WiFi, internet por cable, TV, caja fuerte, lámparas de lectura. Se proporciona ropa de cama y toallas. Queremos que nuestros clientes disfruten y se sientan cómodos, tanto por la atención y el servicio prestado, como por el entorno moderno, tranquilo y acogedor. Sin duda alguna, ellos han sido y son, nuestra razón de ser.",Norte Oviedo Rooms Madrid,120,5.0,"Calle de Piamonte, 9, 28004, Madrid",Justicia,40.4231515,-3.6959202,POINT (-3.6959202 40.4231515),0,0,0,0,0,0,0,0,0,0,0,0,0,0,0,0,0,0,0,0,0,0,0,0,0,0,0,0,0,0,0,0,0,0,0,0,0,0,0,0,0,0,0,0,0,0,0,0,0,0,0,0,0,0,0,0,0,0,0,0,0,0,0,0,0,0,0,0,0,0,0,0,0,0,0,0,0,0,0,0,0,0,0,0,0,0,0,0,0,0,0,0,0,0,0,0,0,0,0,0,0,0,0,0,0,0,0,0,0,0,0,0,0,0,0,0,0,0,0,0,0,0,0,0,0,1,0,0,0,0,0,0,0,0,0,0,0,0,0,0,0,0,0,0,0,0,0,0,0,0,0,0,0,0,0,0,0,0,0,0,0,0,0,0,0,0,0,0,0,0,0,0,0,0,0,0,0,0,0,0,0,0,0,1,0
528,"El personal all�� es maravilloso y muy amable y servicial. Est�� en una excelente ubicaci��n para mi trabajo, pero tambi��n a 10 minutos de la ciudad en taxi o de 5 a 7 minutos de todos los excelentes restaurantes en Serrano y tiendas de lujo. Podr��as caminar a Serrano en 15/20 minutos m��s o menos. Tambi��n hay un excelente restaurante (La Mamona) y un bar (que se convierte en discoteca a medianoche) en el lugar y varios restaurantes a la vuelta de la esquina. Las habitaciones est��n muy bien acabadas y son modernas. Todo lo que necesitas para una estad��a prolongada. Vigile el suelo en la ducha/ba��era. Puede ser resbaladizo. Recibo el apartamento con la oficina, pero no lo uso como oficina porque no me gusta mucho el dise��o. Lo uso como habitaci��n libre para mi equipaje,…",Hyatt Regency Madrid Residences,450,3.0,"Paseo de la Castellana, 62, 28046, Madrid",Almagro,40.4370756,-3.6892799,POINT (-3.6892799 40.4370756),0,0,0,0,0,0,0,0,0,0,0,0,0,0,0,0,0,0,0,0,0,0,0,0,0,0,0,0,0,0,0,0,0,0,0,0,0,0,0,0,0,0,0,0,0,0,0,0,0,0,0,0,0,0,0,0,0,0,0,0,0,0,0,0,0,0,0,0,0,0,0,0,0,0,0,0,0,0,0,0,0,0,0,0,0,0,0,0,0,0,0,0,0,0,0,0,0,0,0,0,0,0,0,0,0,0,0,0,0,0,0,0,0,0,0,0,0,0,0,0,0,0,0,0,0,1,0,0,0,0,0,0,0,0,0,0,0,0,0,0,0,0,0,0,0,0,0,0,0,0,0,0,0,0,0,0,0,0,0,0,0,0,0,0,0,0,0,0,0,0,0,0,0,0,0,0,0,0,0,0,0,0,0,1,0
529,Fatal. El único hotel en el mundo que cobran 10 euros por cada persona por llegar por la noche. Peor de los peores. Encima no publica esto por ningún lado y te avisan como si nada. Estafadores y ladrones sin vergüenza. Les propongo a cobrar 2 euritos cada vez alguien entra por la puerta de su hotel 👍,Hostal Abitum,55,3.0,"Calle de Bravo Murillo, 127, 28020, Madrid",Bellas Vistas,40.4495701,-3.7037609,POINT (-3.7037609 40.4495701),0,1,0,0,0,0,0,0,0,0,0,0,0,0,0,0,0,0,0,0,0,0,0,0,0,0,0,0,0,0,0,0,0,0,0,0,0,0,0,0,0,0,0,0,0,0,0,0,0,0,0,0,0,0,0,0,0,0,0,0,0,0,0,0,0,0,0,0,0,0,0,0,0,0,0,0,0,0,0,0,0,0,0,0,0,0,0,0,0,0,0,0,0,0,0,0,0,0,0,0,0,0,0,0,0,0,0,0,0,0,0,0,0,0,0,0,0,0,0,0,0,0,0,0,0,0,0,0,0,0,0,0,0,0,0,0,0,0,0,0,0,0,0,0,0,0,0,0,0,0,0,0,0,0,0,0,0,0,0,0,0,0,0,0,0,0,0,0,0,0,0,0,0,0,0,0,0,0,0,0,0,0,0,1,0
530,"Hostal de 2* en pleno centro de Madrid, a tan solo 800m de la estación de tren de Atocha. Habitaciones de cama de matrimonio, de dos camas individuales, hasta habitaciones para tres personas, otras accesibles a sillas de ruedas, y hasta unas con terrazas (con suplemento). Hay parking de pago.",easyHotel Madrid Centro Atocha,51,3.0,"Calle Mezquite, 5B, 28045, Madrid",Delicias,40.3966428,-3.6822935,POINT (-3.6822935 40.3966428),0,0,0,0,0,0,0,0,0,0,0,0,0,0,0,0,0,0,0,0,0,0,0,0,0,0,0,0,0,0,0,0,0,0,0,0,0,0,0,0,0,0,0,0,0,0,0,0,0,0,0,0,0,0,0,0,0,0,0,0,0,0,0,0,0,0,0,0,0,0,0,0,0,0,0,0,0,0,0,0,0,0,0,0,0,0,0,0,0,0,0,0,0,0,0,0,0,0,0,0,0,0,0,0,0,0,0,0,0,0,0,0,0,0,0,0,0,0,0,0,0,0,0,0,0,1,0,0,0,0,0,0,0,0,0,0,0,0,0,0,0,0,0,0,0,0,0,0,0,0,0,0,0,0,0,0,0,0,0,0,0,0,0,0,0,0,0,0,0,0,0,0,0,0,0,0,0,0,0,0,0,0,0,1,0
