descripcion,link,nombre,precio,puntuacion,serv_hab,tipo_hab,ubicacion,lat,long
"El Heritage Madrid Hotel cuenta con 46 habitaciones, 7 de ellas suites, donde nuestro principal objetivo es hacerle sentir una experiencia única en uno de los mejores hoteles de Madrid. Todas las habitaciones disponen de conexión wifi de alta velocidad, televisión de pantalla plana y Ihome destinados a hacer su estancia más cómoda y agradable. Los muebles del siglo XIX restaurados con cariño que componen cada habitación han sido traídos de distintos países de Europa propiciando un ambiente acogedor y tranquilo. En Heritage Madrid Hotel todos los detalles están cuidados al máximo detalle con lujo, refinamiento y comodidad haciéndole sentir como en casa.",,Relais & Chateaux Heritage Madrid Hotel,354 €,"5,0","[""Aparcamiento privado de pago cerca"",""Internet de alta velocidad gratuito (wifi)"",""Jacuzzi"",""Bar/salón"",""Actividades para niños (acondicionado para familias / niños)"",""Servicio de taxi"",""Centro de negocios con acceso a Internet"",""Salas de reuniones"",""Albornoces"",""Aire acondicionado"",""Mesa de escritorio"",""Servicio de limpieza"",""Servicio de habitaciones"",""Cafetera/tetera"",""Televisor de pantalla plana"",""Bañera/ducha""]","[""Habitaciones de no fumadores"",""Suites""]","Calle de Diego de León, 43, 28006, Madrid",40.4348678,-3.6790648
"Only YOU Boutique Hotel Madrid te ofrece la oportunidad de vivir una experiencia única y exclusiva. Encontrarás un lugar excepcional, un lugar donde suceden cosas que querrás compartir y de las que tú eres el protagonista. En el corazón de la capital, en un palacete del siglo XIX completamente reformado, se encuentra nuestro hotel diseñado para ti.",,Only YOU Boutique Hotel Madrid,237 €,"5,0","[""Aparcamiento público de pago cerca"",""Internet de alta velocidad gratuito (wifi)"",""Gimnasio / Sala de entrenamiento"",""Bar/salón"",""Servicio de taxi"",""Centro de negocios con acceso a Internet"",""Salas de reuniones"",""Envoltura corporal"",""Cortinas opacas"",""Aire acondicionado"",""Mesa de escritorio"",""Minibar"",""TV por cable o satélite"",""Camas extragrandes"",""Ducha a ras de suelo""]","[""Habitaciones insonorizadas"",""Vistas a la ciudad"",""Habitaciones de no fumadores"",""Suites"",""Habitaciones para familias""]","Calle Barquillo, 21, 28004, Madrid",40.556242049999994,-3.327739945945809
"Bienvenido a Dear Hotel,el nuevo hotel boutique de diseño en el centro de Madrid,con impresionantes vistas sobre Gran Vía y Plaza de España.El hotel cuenta en la planta 14 con el Restaurante & Lounge bar Nice to meet you,con terraza panorámica,vistas 360ºy una Skypool. Cocina actual,en un ambiente cosmopolita y distendido,cócteles,y música DJ.",No hay link,Dear Hotel Madrid,164 €,"4,5","[""Aparcamiento privado de pago cerca"",""Internet de alta velocidad gratuito (wifi)"",""Piscina"",""Bar/salón"",""Transporte desde/al aeropuerto"",""Salas de reuniones"",""Terraza en el ático"",""Vigilancia 24 horas"",""Aire acondicionado"",""Servicio de limpieza"",""Balcón privado"",""Servicio de habitaciones"",""Minibar"",""Frigorífico"",""Televisor de pantalla plana""]","[""Habitaciones insonorizadas"",""Habitaciones de no fumadores"",""Suites""]","Calle Gran Vía, 80, 28013, Madrid",40.47083205,-3.871344282431271
"Only YOU Hotel Atocha: El hotel se encuentra ubicado en una zona céntrica de Madrid, en el paseo Infanta Isabel, frente a la estación de tren Madrid Puerta de Atocha y a escasos metros del parque del Retiro. A la belleza del edificio histórico, se añade su cuidado diseño, un interiorismo basado en el juego ecléctico de recursos con un carácter sofisticadamente desenfadado con la intención de crear un ambiente de confort urbano.",,Only YOU Hotel Atocha,167 €,"5,0","[""Aparcamiento privado de pago dentro del recinto"",""Internet de alta velocidad gratuito (wifi)"",""Gimnasio / Sala de entrenamiento"",""Bar/salón"",""Alquiler de coches"",""Centro de negocios con acceso a Internet"",""Instalaciones para conferencias"",""Terraza en el ático"",""Habitación hipoalergénica"",""Cortinas opacas"",""Aire acondicionado"",""Servicio de limpieza"",""Balcón privado"",""Servicio de habitaciones"",""Minibar"",""Televisor de pantalla plana"",""Suite nupcial""]","[""Habitaciones de no fumadores"",""Suites"",""Habitaciones para familias""]","Paseo de la Infanta Isabel, 13, 28014, Madrid",40.407278649999995,-3.6880393131745315
"El hotel ARTIEM Madrid se convertirá en tu segunda casa cuando viajes por negocios. Este rincón es perfecto para celebrar una reunión, inspirarse para trabajar, seguir tu rutina deportiva y, por supuesto desconectar de la capital. Aquí, encontraras paz y descanso. Te enamorará este pequeño oasis urbano con mucho “green” diseñado para convertirse en el refugio al que regresar para relajarse después de un intenso día en Madrid. Ubicado en el barrio residencial de Arturo Soria, a tan solo 15 minutos del aeropuerto y 12 minutos en coche del centro de Madrid.",https://www.tripadvisor.es/Commerce?p=TABAIndependentHotels&src=0&geo=231633&from=Hotel_Review&area=&slot=3&matchID=1&oos=0&cnt=1&silo=30356&bucket=875171&ubucket=875171&nrank=1&crank=1&clt=CLD&tm=258366266&managed=false&capped=false&gosox=5_3Y6UYwwGjgw_c7hEwIkUPMoXqF0WqUzs16nPFFbTQ4ZBHvjhROZ6olw0GKVMxlvzQgqHipUfHem4xE_ixrxQ&adults=2&child_rm_ages=&inDay=19&outDay=20&rooms=1&inMonth=3&inYear=2023&outMonth=3&outYear=2023&def_d=true&bapid=3&cs=197f5b70949920b64a4829a4a4fab01c8&ba_uid=d2a09050-e580-4def-9551-af87354183c8,ARTIEM Madrid,101 €,"5,0","[""Aparcamiento privado de pago dentro del recinto"",""Internet de alta velocidad gratuito (wifi)"",""Bar/salón"",""Servicio de taxi"",""Espacio para guardar el equipaje"",""Conserje"",""Recepción 24 horas"",""Lavado en seco"",""Habitación hipoalergénica"",""Cortinas opacas"",""Servicio de limpieza"",""Servicio de habitaciones"",""Caja fuerte"",""Televisor de pantalla plana"",""Secador de pelo""]","[""Habitaciones insonorizadas"",""Habitaciones de no fumadores"",""Suites""]","Calle Juan Pérez Zúñiga, 20, 28027, Madrid",40.7656182,-3.7794442
"¿Buscas donde alojarte en Madrid? Entonces no te pierdas Artrip Hotel, un hotel boutique que te acerca a lo mejor de Madrid.
Las habitaciones de los huéspedes incluyen televisor de pantalla plana y aire acondicionado, y Artrip Hotel te ayuda a que estés conectado, ya que dispone de wifi gratuito.
También puedes aprovechar algunos de los servicios que ofrece el hotel, como recepción abierta 24 horas, conserje y espacio para guardar el equipaje. Además, los huéspedes pueden disfrutar de desayuno buffet durante su visita. Otra ventaja añadida es que hay aparcamiento público de pago cerca disponible para los huéspedes.",No hay link,Artrip Hotel,150 €,"5,0","[""Aparcamiento público de pago cerca"",""Aparcamiento en la calle"",""Internet de alta velocidad gratuito (wifi)"",""Cafetería"",""Servicio de taxi"",""Espacio para guardar el equipaje"",""Conserje"",""Recepción 24 horas"",""Aire acondicionado"",""Balcón privado"",""Caja fuerte"",""Teléfono"",""Televisor de pantalla plana"",""Bañera/ducha"",""Artículos de aseo gratuitos de cortesía""]","[""Habitaciones insonorizadas"",""Habitaciones de no fumadores"",""Suites"",""Habitaciones para familias""]","Calle de Valencia, 11, 28012, Madrid",40.43166585,-3.5270602428440396
"El Hotel Riu Plaza España abrió sus puertas en agosto de 2019 en el Edificio España que es el octavo edificio más alto de Madrid, España, y uno de los edificios más icónicos de la ciudad. Es un ejemplo de la arquitectura española del siglo 20 construido en estilo neobarroco. Se encuentra a unos aprox. 20 km del aeropuerto de Madrid-Barajas Adolfo Suárez (MAD). Este hotel es ideal tanto para viajes de ocio como de negocios. Las 584 habitaciones de diseño moderno y elegantemente decoradas, con Wi-Fi gratuito, ofrecen el máximo confort y descanso. En las 17 elegantes y modernas salas de conferencias podrá organizar con éxito sus eventos y reuniones. Para los amantes de la gastronomía, se ofrece a los huéspedes un restaurante buffet, así como un Sky Bar y un Lobby Bar para aperitivos y bebidas. Visite la reinventada azotea. La terraza de 360º cuenta ahora con un nuevo Gastrobar llamado El Edén y un atractivo más que se suma a sus espectaculares vistas de la capital: un mirador transparente que da a la recién inaugurada Plaza de España. Este balcón acristalado que cuelga a 100 metros de altura sobre el suelo ofrece a los visitantes más intrépidos una panorámica espectacular de la zona sur de la capital.",,Hotel Riu Plaza España,169 €,"4,0","[""Aparcamiento público de pago cerca"",""Internet de alta velocidad gratuito (wifi)"",""Piscina"",""Gimnasio / Sala de entrenamiento"",""Bar/salón"",""Guardería"",""Servicio de taxi"",""Centro de negocios con acceso a Internet"",""Aire acondicionado"",""Mesa de escritorio"",""Servicio de limpieza"",""Balcón privado"",""Cafetera/tetera"",""TV por cable o satélite"",""Sofá cama"",""Bañera de hidromasaje""]","[""Vistas a la ciudad"",""Habitaciones de no fumadores"",""Suites"",""Habitaciones para familias""]","Calle Gran Vía, 84, 28013, Madrid",40.47083205,-3.871344282431271
"El Hotel ME Madrid Reina Victoria se encuentra estratégicamente situado en el centro de la ciudad, con fácil acceso a los principales puntos de interés como son los Museos del Prado, Thyssen-Bornemisza y Reina Sofía, el Parque del Retiro, el Congreso, Puerta del Sol, Plaza Mayor, el Palacio Real y la zona comercial y empresarial.",,ME Madrid Reina Victoria,225 €,"4,5","[""Punto de recarga de vehículos eléctricos"",""Internet de alta velocidad gratuito (wifi)"",""Gimnasio / Sala de entrenamiento"",""Bar/salón"",""Alquiler de bicicletas"",""Pub/DJ"",""Guardería"",""Se admiten mascotas"",""Habitación hipoalergénica"",""Aire acondicionado"",""Balcón privado"",""Servicio de habitaciones"",""Minibar"",""Televisor de pantalla plana""]","[""Habitaciones insonorizadas"",""Habitaciones interconectadas disponibles"",""Habitaciones de no fumadores"",""Suites""]","Plaza de Santa Ana, 14, 28012, Madrid",40.41456395,-3.7015890513330527
"El Gran Hotel Inglés data del año 1886, el primer hotel construido en Madrid. Totalmente restaurado y renovado bajo la dirección artística de Rockwell Group. El hotel se ha convertido en una de las propiedades más lujosas de Madrid. Situado en una ubicación incomparable en el centro de la ciudad, se encuentra cerca de la zona cultural, el área comercial y las zonas de ocio de la capital. Entre sus muchos atributos se destaca un sofisticado restaurante que combina tradición e innovación en su gastronomía, un completo gimnasio con equipamiento de vanguardia con un variado programa de servicios y actividades, y una zona de bienestar integral con amplia variedad de productos y tratamientos exclusivos.",,Gran Hotel Inglés,496 €,"5,0","[""Servicio de aparcacoches"",""Internet de alta velocidad gratuito (wifi)"",""Jacuzzi"",""Gimnasio / Sala de entrenamiento"",""Desayuno gratuito"",""Guardería"",""Se admiten mascotas"",""Transporte desde/al aeropuerto"",""Habitación hipoalergénica"",""Cortinas opacas"",""Aire acondicionado"",""Servicio de limpieza"",""Minibar"",""TV por cable o satélite"",""Camas extragrandes"",""Ducha a ras de suelo""]","[""Vistas a la ciudad"",""Vistas a sitios de interés turístico"",""Habitaciones de no fumadores"",""Suites"",""Habitaciones para familias""]","Calle de Echegaray, 8, 28014, Madrid",40.4159077,-3.699693
"EL HOTEL PRÍNCIPE PÍO ESTA SITUADO EN EL CORAZÓN DE MADRID.
Con un total de 148 habitaciones y con una ubicación privilegiada Frente al Palacio Real y enclavado en el centro histórico, cultural y de ocio de Madrid-, el hotel Príncipe Pío es el establecimiento perfecto para visitar la capital, ya sea por viajes de negocios, o bien, para disfrutar de la oferta cultural y gastronómica de Madrid acompañado por la familia.",,Hotel Principe Pio,83 €,"4,0","[""Aparcamiento privado de pago cerca"",""Internet de alta velocidad gratuito (wifi)"",""Desayuno disponible"",""Alquiler de bicicletas"",""Servicio de taxi"",""Espacio para guardar el equipaje"",""Conserje"",""Registro de entrada 24 horas"",""Aire acondicionado"",""Mesa de escritorio"",""Servicio de limpieza"",""Servicio de habitaciones"",""Caja fuerte"",""Televisor de pantalla plana"",""Bañera/ducha"",""Artículos de aseo gratuitos de cortesía""]","[""Habitaciones de no fumadores"",""Habitaciones para familias""]","Cuesta de San Vicente, 14, 28008, Madrid",40.421358999999995,-3.7149851843297927
"Elegante hotel de diseño que se encuentra en la exclusiva zona del Paseo del Prado, junto a la Bolsa de Madrid, la Plaza Neptuno y a pocos minutos andando del Museo del Prado y del Parque del Retiro. Ubicado en un antiguo edificio de cinco alturas, construido a principios del siglo XIX. Todas las habitaciones cuentan con WIFI gratuito en todo el edificio. El hotel cuenta con 71 elegantes habitaciones repartidas en cinco pisos y un apartamento totalmente equipado con cocina incluida. Todas las habitaciones están decoradas con muebles modernos y a su vez cómodos para asegurar que al cliente no le falta nada durante su estancia. En el restaurante del Hotel Petit Palace Lealtad Plaza se ofrece un exquisito desayuno buffet cada mañana compuesto por una amplia selección de productos y platos tanto calientes como fríos para que los clientes puedan empezar el día con la energía necesaria. El hotel ofrece un exclusivo alquiler de bicicletas de forma gratuita y acepta mascotas hasta un máximo de 15 kg (cestas y cuencos disponibles gratuitamente). Recepción de 24 horas.",No hay link,Petit Palace Lealtad Plaza,143 €,"4,5","[""Aparcamiento privado de pago cerca"",""Internet de alta velocidad gratuito (wifi)"",""Bar/salón"",""Alquiler de bicicletas"",""Tronas disponibles"",""Carritos de bebé"",""Alquiler de coches"",""Centro de negocios con acceso a Internet"",""Aire acondicionado"",""Servicio de limpieza"",""Servicio de habitaciones"",""Teléfono"",""Minibar"",""Televisor de pantalla plana"",""Artículos de aseo gratuitos de cortesía"",""Secador de pelo""]","[""Habitaciones de no fumadores"",""Suites"",""Habitaciones para familias""]","Calle Antonio Maura, 5, 28014, Madrid",40.5860137,-3.9217182
"Moderno Boutique hotel de diseño cuatro estrellas, situado en la principal calle comercial de Madrid, calle Preciados. Su excelente ubicación, entre Plaza España – Gran Vía – Paseo del Prado – Puerta del Sol y Plaza Mayor, permite ofrecer a sus clientes los mayores atractivos culturales y comerciales de Madrid. MINIBAR y WIFI GRATUITO en todas las habitaciones.La tranquilidad en su entorno, cortesía, elegancia y la comodidad, son el encanto y la grandeza del Hotel Preciados.",No hay link,Hotel Preciados,134 €,"4,5","[""Aparcamiento privado de pago dentro del recinto"",""Internet de alta velocidad gratuito (wifi)"",""Bar/salón"",""Canales de televisión infantiles"",""Tronas disponibles"",""Alquiler de coches"",""Centro de negocios con acceso a Internet"",""Instalaciones para conferencias"",""Habitación hipoalergénica"",""Cortinas opacas"",""Aire acondicionado"",""Mesa de escritorio"",""Minibar"",""TV por cable o satélite"",""Camas extragrandes"",""Ducha a ras de suelo""]","[""Vistas a la ciudad"",""Habitaciones de no fumadores"",""Suites""]","Calle Preciados, 37, 28013, Madrid",40.4196853,-3.7074213
"¿Buscas un lugar para alojarte en Madrid? Entonces no te pierdas Caballero Errante Hotel, un hotel económico que te acerca a lo mejor de Madrid. Las habitaciones de los huéspedes estan equipadas con todo lo necesario para una estancia agradable. También puedes aprovechar algunos de los servicios que ofrece el hotel, como recepción abierta las 24 horas, registro de entrada las 24 horas. Además, los huéspedes pueden disfrutar de desayuno durante su visita. Como una comodidad adicional, hay estacionamiento (de pago) disponible para los huéspedes. Al estar cerca de algunos de los puntos de referencia más populares de Madrid, como Paseo de la Castellana, Faro de Moncloa (3,9 km) y Metrópolis (3,9 km), Caballero Errante Hotel es un magnífico destino para turistas. Mientras estés en Madrid, quizás quieras ir a algunos de los restaurantes que se encuentran a poca distancia a pie de Caballero Errante Hotel, como DiverXO (0,8 km), De Maria Felix Boix (0,4 km) y Sacha (0,6 km). Durante su visita, asegúrese de visitar atracciones populares como Stadio Santiago Bernabeu (1,0 km), Centro de Exposiciones de Arte del Canal (0,4 km) y Paseo de la Castellana (0,9 km), a las que se puede acceder a pie desde el hotel. Estamos seguros de que disfrutarás de tu estancia en Caballero Errante Hotel mientras descubres todo lo que Madrid tiene para ofrecer.",,Hotel Caballero Errante,65 €,"4,5","[""Aparcamiento privado de pago dentro del recinto"",""Internet de alta velocidad gratuito (wifi)"",""Bar/salón"",""Se admiten mascotas"",""Espacio para guardar el equipaje"",""Conserje"",""Registro de entrada 24 horas"",""Recepción 24 horas"",""Aire acondicionado"",""Mesa de escritorio"",""Servicio de limpieza"",""Caja fuerte"",""Minibar"",""Televisor de pantalla plana"",""Secador de pelo""]","[""Habitaciones insonorizadas"",""Habitaciones de no fumadores"",""Habitaciones para fumadores disponibles""]","Calle Pinos Alta, 14, 28029, Madrid",40.4699865,-3.7000827
"Un hotel que piensa en el viajero urbanita, el que quiere disfrutar de la ciudad y de su parte más vibrante y cosmopolita, pero el que también quiere encontrar un punto de desconexión y relax sin salir del hotel.
Desayunar en la terraza, comer una pizza con sello napolitano, disfrutar de un cóctel con una de las mejores vistas panorámicas de Madrid o hacerte una foto durante el atardecer. Todo ello es posible aquí.",No hay link,Pestana CR7 Gran Vía Madrid,140 €,"4,5","[""Aparcamiento público de pago cerca"",""Internet de alta velocidad gratuito (wifi)"",""Piscina en la azotea"",""Gimnasio / Sala de entrenamiento"",""Bar/salón"",""Instalaciones para conferencias"",""Zona para tomar el sol"",""Terraza-solario"",""Cortinas opacas"",""Aire acondicionado"",""Servicio de habitaciones"",""Sofá"",""Teléfono"",""Minibar"",""TV por cable o satélite"",""Bañera/ducha""]","[""Vistas a la ciudad"",""Habitaciones de no fumadores""]","Calle Gran Vía, 29, 28013, Madrid",40.47083205,-3.871344282431271
"Si buscas un hotel con encanto en Madrid, no te pierdas Catalonia Atocha.
Como está cerca de la mayoría de los puntos de referencia de Madrid, como Plaza de Santa Ana (0,4 km) y La Latina (0,9 km), Catalonia Atocha Calle Atocha 81 Hotel es un fantástico destino para turistas.
Las habitaciones de los huéspedes incluyen televisor de pantalla plana, aire acondicionado y minibar, y Catalonia Atocha te ayuda a que estés conectado, ya que dispone de wifi gratuito.",No hay link,Catalonia Atocha,160 €,"4,5","[""Aparcamiento"",""Internet de alta velocidad gratuito (wifi)"",""Jacuzzi"",""Bar/salón"",""Se admiten mascotas"",""Servicio de taxi"",""Centro de negocios con acceso a Internet"",""Instalaciones para conferencias"",""Aire acondicionado"",""Mesa de escritorio"",""Balcón privado"",""Servicio de habitaciones"",""Minibar"",""Televisor de pantalla plana"",""Artículos de aseo gratuitos de cortesía""]","[""Habitaciones insonorizadas"",""Habitaciones de no fumadores"",""Suites"",""Habitaciones para familias""]","Calle de Atocha, 81, 28012, Madrid",40.4119257,-3.6977945
"Axel Hotel Madrid está ubicado en el número 49 de la calle Atocha, ubicado en el popular Barrio de las Letras, y rodeado de las calles más emblemáticas de la ciudad, en un enclave bohemio que combina diversión, compras y buena gastronomía. El hotel dispondrá de 88 habitaciones y en Axel Hotel Madrid encontrarás tu punto de encuentro en la capital, con sus innovadores espacios de ocio en los que cuidarte y divertirte, siempre fiel al concepto Axel de estilo, diseño, confort y ambiente cosmopolita.",No hay link,Axel Hotel Madrid,121 €,"4,5","[""Aparcamiento privado de pago cerca"",""Internet de alta velocidad gratuito (wifi)"",""Piscina"",""Gimnasio / Sala de entrenamiento"",""Bar/salón"",""Servicio de taxi"",""Salas de reuniones"",""Masaje"",""Aire acondicionado"",""Balcón privado"",""Servicio de habitaciones"",""Caja fuerte"",""Teléfono"",""Equipamiento para sala VIP"",""Minibar"",""Televisor de pantalla plana""]","[""Habitaciones de no fumadores"",""Suites""]","Calle de Atocha, 49, 28012, Madrid",40.413134,-3.7005625
La estancia perfecta en una convención de trabajo. Dejé mi portátil olvidado en la habitación y la atención y gestión por parte del hotel ha sido perfecta. Cuando las cosas dejan de ser normales se demuestra la excelencia y lo han clavado. Gracias,,Canopy by Hilton Madrid Castellana,173 €,"4,5","[""Aparcamiento público de pago cerca"",""Internet de alta velocidad gratuito (wifi)"",""Piscina"",""Gimnasio / Sala de entrenamiento"",""Bar/salón"",""Se admiten mascotas"",""Alquiler de coches"",""Centro de negocios con acceso a Internet"",""Aire acondicionado"",""Servicio de limpieza"",""Servicio de habitaciones"",""Minibar"",""Televisor de pantalla plana"",""Películas bajo demanda"",""Bañera/ducha""]","[""Habitaciones interconectadas disponibles"",""Vistas a la montaña"",""Vistas a la ciudad"",""Vistas a sitios de interés turístico"",""Habitaciones de no fumadores"",""Suites""]","Plaza Carlos Trias Bertran, 4, 28020, Madrid",40.4520386,-3.6939437
"La ubicación privilegiada de VP El Madroño en pleno Barrio de Salamanca y el acceso prácticamente directo al aeropuerto de Barajas y al Recinto Ferial (Ifema), hacen del VP El Madroño una de las mejores elecciones para poder disfrutar de Madrid, de sus museos y monumentos más representativos, de su variada gastronomía y de sus espléndidas zonas comerciales. Nuestro establecimiento, dispone de unas amplias habitaciones que se adaptan a todo tipo de estancias, ya sean para viajes de larga duración, de negocios o familiares. VP El Madroño dispone de Parking propio vigilado 24 horas con precios especiales para clientes alojados. Nuestro establecimiento es, sin lugar a dudas, una estupenda elección tanto para sus viajes de negocio como para conocer y disfrutar la ciudad.",No hay link,VP El Madroño,94 €,"4,5","[""Aparcamiento privado de pago dentro del recinto"",""Internet de alta velocidad gratuito (wifi)"",""Desayuno disponible"",""Se admiten mascotas"",""Alquiler de coches"",""Centro de negocios con acceso a Internet"",""Instalaciones para conferencias"",""Espacio para guardar el equipaje"",""Cortinas opacas"",""Aire acondicionado"",""Servicio de limpieza"",""Servicio de habitaciones"",""Caja fuerte"",""Cocina americana"",""Microondas"",""Televisor de pantalla plana""]","[""Habitaciones de no fumadores"",""Habitaciones para familias""]","Calle del General Díaz Porlier, 101, 28006, Madrid",40.4351616,-3.6764792
"Vive Madrid como nunca antes lo habías hecho alojándote en el Hotel Chamartín The One, un renovado hotel junto a la estación de Chamartín, Madrid, con espacios de diseño contemporáneo y servicios especializados en el viajero de ocio y en los que acuden a la capital por negocios para celebrar eventos, congresos y reuniones. Disfruta de las ventajas de un hotel 4 estrellas al lado del Paseo de la Castellana, a escasos minutos del Aeropuerto de Madrid Adolfo Suárez Barajas y los recintos feriales de IFEMA, muy cerca del estadio Bernabéu y los principales puntos de interés de Madrid y perfectamente conectado con los centros de negocios más activos de la capital. Moderno, equipado con última tecnología y con atención personalizada, es una opción perfecta para descansar, trabajar y descubrir toda la ciudad de Madrid. Elige tu habitación en Chamartín The One y presume de hotel en Madrid, Madrid. Siempre con la mejor tarifa online asegurada reservando directamente desde aquí, en exclusiva: bienvenido a la web oficial del Hotel Chamartín The One.",,Hotel Chamartín The One,91 €,"3,5","[""Aparcamiento privado de pago cerca"",""Internet de alta velocidad gratuito (wifi)"",""Bar/salón"",""Servicio de taxi"",""Centro de negocios con acceso a Internet"",""Instalaciones para conferencias"",""Vigilancia 24 horas"",""Espacio para guardar el equipaje"",""Cortinas opacas"",""Aire acondicionado"",""Mesa de escritorio"",""Servicio de limpieza"",""Servicio de habitaciones"",""Minibar"",""Televisor de pantalla plana"",""Bañera/ducha""]","[""Habitaciones de no fumadores"",""Suites"",""Habitaciones para familias""]","Calle de Agustín de Foxá, s/n, 28036, Madrid",40.47220955,-3.683898918115726
"Si buscas un hotel para familias en Madrid, no te pierdas Hilton Madrid Airport.
Durante su estancia en Hilton International Madrid, los huéspedes pueden visitar Sculpture of Fingers (1,2 km) y cines odeon (3,9 km), que son algunas de las principales atracciones de Madrid.
Las habitaciones de los huéspedes ofrecen servicios como televisor de pantalla plana, aire acondicionado y minibar, y los huéspedes pueden permanecer conectados con wifi gratuito que ofrece el hotel.",,Hilton Madrid Airport,136 €,"4,0","[""Aparcamiento privado de pago dentro del recinto"",""Internet de alta velocidad gratuito (wifi)"",""Piscina"",""Gimnasio / Sala de entrenamiento"",""Bar/salón"",""Consola de videojuegos"",""Guardería"",""Se admiten mascotas"",""Aire acondicionado"",""Mesa de escritorio"",""Servicio de habitaciones"",""Caja fuerte"",""Cafetera/tetera"",""Minibar"",""Televisor de pantalla plana"",""Bañera/ducha""]","[""Habitaciones de no fumadores"",""Suites"",""Habitaciones para familias""]","Avenida de Hispanidad, 2-4, 28042, Madrid",40.4521752,-3.5855655000000004
