descripcion,link,nombre,precio,puntuacion,serv_hab,tipo_hab,ubicacion,lat,long
"Situado en la Cava Baja número 12, en pleno centro de la ciudad del Madrid de los Austrias. Enclavado en el centro de La Latina, barrio bohemio, con sabor y solera y último refugio de artistas, actores y poetas. Esta antigua Posada ha sido convertida en un hotel de diseño único y estilo singular. Cuenta con 17 amplias habitaciones, todas ellas diferentes. Atravesada de lado a lado por la Muralla Cristiana del Siglo XII. Parte de ella ha sido también recuperada. Mantiene igualmente intacta la corrala original de finales del siglo XIX. Papel importante jugará el “Vino” en la Enotaberna del León de Oro. Seremos una referencia enológica en la zona debido a que vamos a contar con más de 300 referencias de vinos. Entre estos tendrán especial relevancia los Vinos de Denominación de Origen de la Comunidad de Madrid ya que es la única capital de un país en todo el mundo que le da nombre a una Denominación de origen de vino. También podrá disfrutar de una renovada cocina tradicional.",No hay link,Posada del Leon de Oro,111 €,"4,5","[""Internet de alta velocidad gratuito (wifi)"",""Wifi"",""Restaurante"",""Alquiler de bicicletas"",""Alquiler de coches"",""Espacio para guardar el equipaje"",""Conserje"",""Recepción 24 horas"",""Aire acondicionado"",""Balcón privado"",""Servicio de habitaciones"",""Caja fuerte"",""Minibar"",""Televisor de pantalla plana"",""Secador de pelo""]","[""Habitaciones insonorizadas"",""Habitaciones de no fumadores""]","Calle de la Cava Baja, 12, 28005, Madrid",40.4131961,-3.7085173
"Bienvenido a 7 Islas Hotel, tu segundo hogar en Madrid. 7 Islas Hotel tiene como objetivo conseguir que tu visita sea lo más relajante y agradable posible, razón por la que tantos huéspedes siguen volviendo año tras año.
Como está muy cerca de conocidos puntos de referencia, como Plaza de Santa Ana (0,7 km) y Plaza Mayor (0,8 km), los huéspedes de Hotel Siete Islas Madrid pueden acceder con facilidad a algunas de las atracciones más conocidas de Madrid.",,7 Islas Hotel,128 €,"4,5","[""Aparcamiento público de pago cerca"",""Internet de alta velocidad gratuito (wifi)"",""Bar/salón"",""Alquiler de bicicletas"",""Pub/DJ"",""Tronas disponibles"",""Alquiler de coches"",""Salas de reuniones"",""Cortinas opacas"",""Albornoces"",""Mesa de escritorio"",""Chimenea"",""Servicio de limpieza"",""Hervidor eléctrico"",""Televisor de pantalla plana"",""Bidé""]","[""Vistas a la ciudad"",""Suites""]","Calle Valverde, 14, 28004, Madrid",40.4212694,-3.701932
"Erase un Hotel con un Gran WiFi, situado en el distrito financiero de Madrid, se encuentra a 100 mts. del Metro estación Valdeacederas Linea 1, a 600 mts. del Estadio de fútbol Santiago Bernabéu del Real Madrid, a 400 mts. de los Juzgados de Plaza Castilla. a 800 mts. del Hospital La Paz, a 200 mts. del conocidisimo restaurante Asador Donostiarra, a 200 mts. del Rastro de Marqués de Viana y a 1,8 km de la Estación de tren de Charmartín. La conexión WiFi es gratuita.
Los alojamientos del hotel son confortables y acogedores. Las instalaciones del hotel, amplias y funcionales, incluyen Aparcamiento y una Sala de Reuniones.",No hay link,Erase un Hotel,70 €,"3,5","[""Aparcamiento privado de pago dentro del recinto"",""Garaje"",""Internet de alta velocidad gratuito (wifi)"",""Cafetería"",""Alquiler de coches"",""Espacio para guardar el equipaje"",""Conserje"",""Recepción 24 horas"",""Aire acondicionado"",""Agua embotellada"",""Frigorífico"",""Televisor de pantalla plana""]","[""Habitaciones de no fumadores""]","Calle de Bravo Murillo, 304, 28020, Madrid",40.4630252,-3.6966864
"Calidad precio sobresaliente. Limpieza, buena atención, bien ubicado… la verdad es que no puedo decir nada negativo salvo que no habia barrera de seguridad en las literas superiores ni cortinilla para dar un poco mas de seguridad xxxxxxxx",,Bastardo Hostel,111 €,"4,5","[""Internet de alta velocidad gratuito (wifi)"",""Wifi"",""Bar/salón"",""Restaurante"",""Espacio para guardar el equipaje"",""Conserje"",""Servicio de lavandería"",""Autoservicio de lavandería"",""Aire acondicionado"",""Cocina americana""]","[""Habitaciones de no fumadores"",""Habitaciones para familias""]","Calle de San Mateo, 3, 28004, Madrid",40.4252314,-3.7002181
"Buen aspecto exterior, buen precio y muy decepcionante la habitacion de dimension pequeña. Sin enchufe cerca de la cama y sin mando a distancia para la tv Por lo demás, suficiente en todos los servicios.",No hay link,Hotel Exe Zarzuela Park,83 €,"4,0","[""Aparcamiento gratuito"",""Internet de alta velocidad gratuito (wifi)"",""Piscina"",""Gimnasio / Sala de entrenamiento"",""Bar/salón"",""Centro de negocios con acceso a Internet"",""Instalaciones para conferencias"",""Espacio para guardar el equipaje"",""Aire acondicionado"",""Mesa de escritorio"",""Servicio de habitaciones"",""Caja fuerte"",""Minibar"",""Televisor de pantalla plana"",""Bañera/ducha"",""Artículos de aseo gratuitos de cortesía""]","[""Habitaciones de no fumadores"",""Suites"",""Habitaciones para familias"",""Habitaciones para fumadores disponibles""]","Calle Darío Aparicio, 32, 28023, Madrid",40.4663496,-3.7663769
"HRC Hotel es una magnífica elección para viajeros que vayan a Madrid, ya que ofrece un ambiente para familias además de numerosos servicios diseñados para mejorar su estancia.
Las habitaciones de los huéspedes ofrecen servicios como televisor de pantalla plana, aire acondicionado y minibar, y los huéspedes pueden permanecer conectados con wifi gratuito que ofrece el hotel.
HRC Hotel tiene recepción abierta 24 horas, conserje y prensa para que la estancia sea más agradable. El establecimiento también cuenta con bar. Si vas a en coche a Hostal Reyes Catolicos Santiago, hay aparcamiento disponible.",No hay link,HRC Hotel,75 €,"4,0","[""Aparcamiento privado de pago dentro del recinto"",""Internet de alta velocidad gratuito (wifi)"",""Bar/salón"",""Pub/DJ"",""Alquiler de coches"",""Espacio para guardar el equipaje"",""Conserje"",""Recepción 24 horas"",""Aire acondicionado"",""Mesa de escritorio"",""Caja fuerte"",""Minibar"",""Televisor de pantalla plana"",""Bañera/ducha"",""Secador de pelo""]","[""Habitaciones de no fumadores""]","Calle Ángel, 18, 28005, Madrid",40.4099286,-3.7132001
"Hotel situado en el barrio de Salamanca, ofrece 144 habitaciones reformadas. Cerca de los recintos feriales y del aeropuerto Adolfo Suarez Madrid Barajas, está conectado con el casco histórico de Madrid en transporte público. Situado a pocos minutos de la Puerta de Alcalá, del Estadio Santiago Bernabéu, Auditorio Nacional de Música y la Plaza de Toros de las Ventas.",,AC Hotel Avenida de America by Marriott,99 €,"4,0","[""Aparcamiento privado de pago dentro del recinto"",""Internet de alta velocidad gratuito (wifi)"",""Gimnasio / Sala de entrenamiento"",""Bar/salón"",""Centro de negocios con acceso a Internet"",""Instalaciones para conferencias"",""Masaje"",""Espacio para guardar el equipaje"",""Cortinas opacas"",""Aire acondicionado"",""Mesa de escritorio"",""Servicio de limpieza"",""Cafetera/tetera"",""Televisor de pantalla plana"",""Artículos de aseo gratuitos de cortesía""]","[""Habitaciones insonorizadas"",""Habitaciones de no fumadores""]","Calle de Cartagena, 83-85, 28028, Madrid",40.4310454,-3.6705392
"Bienvenidos a Santa Ana, ubicado sobre una calle empedrada en el Barrio de las Letras. Los balcones de hierro forjado complementan la fachada blanca restaurada construida originalmente en 1880. En el interior, su espacio incluye una cocina surtida, lavadora en la suite y todo lo necesario para una estadía cómoda. Este barrio literario es la antigua casa de muchos de los grandes escritores españoles. Y la cultura no se detiene allí. El histórico Teatro Español está en la plaza al final de la calle. O puede descubrir el trabajo de artistas como Goya en el cercano Museo del Prado. Hoy en día, este barrio está en el corazón de la noche madrileña. Bebe sangría, prueba tapas y saborea la ciudad como los españoles. Hagas lo que hagas, Madrid siempre es memorable en Santa Ana. Este edificio está ubicado en una calle muy transitada y es propenso al ruido de jueves a domingo.",,Sonder Santa Ana,127 €,"4,5","[""Aparcamiento público de pago cerca"",""Internet de alta velocidad gratuito (wifi)"",""Café instantáneo de cortesía"",""Vigilancia 24 horas"",""Espacio para guardar el equipaje"",""Registro de entrada 24 horas"",""Recepción 24 horas"",""Lavadora"",""Cortinas opacas"",""Aire acondicionado"",""Comedor"",""Servicio de limpieza"",""Caja fuerte"",""Cafetera/tetera"",""Televisor de pantalla plana"",""Ducha a ras de suelo""]","[""Habitaciones de no fumadores"",""Suites""]","Calle Príncipe, 11, 28012, Madrid",40.4157636,-3.7002673
"Hotel Meninas es un pequeño Hotel Boutique situado en pleno Centro del Madrid de los Austria, en una de las zonas más bellas y señoriales, junto al Palacio Real y el Teatro de la Ópera. A escasos pasos de los principales puntos de interés turísticos y Museos. Ocupa un elegante edificio señorial del Siglo XIX rehabilitado en su totalidad y convertido en un coqueto hotel con encanto, dónde se han respetado todos los elementos estructurales del edificio. Cuenta con una decoración cuidada y cálida, ambiente muy agradable y entorno familiar.",No hay link,Hotel Meninas - Boutique Hotel,108 €,"4,0","[""Aparcamiento público de pago cerca"",""Internet de alta velocidad gratuito (wifi)"",""Bar/salón"",""Guardería"",""Servicio de traslado en autobús"",""Salas de reuniones"",""Balneario"",""Hotel de no fumadores"",""Aire acondicionado"",""Servicio de habitaciones"",""Caja fuerte"",""Minibar"",""Televisor de pantalla plana""]","[""Habitaciones de no fumadores"",""Suites"",""Habitaciones para familias""]","Calle Campomanes, 7, 28013, Madrid",40.4361805,-3.8175016
"El Hotel Gran Versalles se ubica en el centro de Madrid junto a la Plaza de Alonso Martínez y muy próximo al conocido barrio de Chueca. Se puede ir caminado hasta la Gran Vía o la calle Serrano mediante un paseo de unos 10 minutos, o bien tomar el metro en Alonso Martínez, con 3 líneas de conexión (4,5 y 10), que le llevará rápidamente a cualquier punto de la ciudad, incluso al Aeropuerto en tan solo 30 minutos.",No hay link,Hotel Gran Versalles,89 €,"4,0","[""Aparcamiento privado de pago dentro del recinto"",""Internet de alta velocidad gratuito (wifi)"",""Bar/salón"",""Centro de negocios con acceso a Internet"",""Instalaciones para conferencias"",""Espacio para guardar el equipaje"",""Conserje"",""Registro de entrada 24 horas"",""Cortinas opacas"",""Aire acondicionado"",""Servicio de habitaciones"",""Caja fuerte"",""Equipamiento para sala VIP"",""Minibar"",""Televisor de pantalla plana""]","[""Habitaciones insonorizadas"",""Habitaciones de no fumadores"",""Suites"",""Habitaciones para familias""]","Calle de Covarrubias, 4, 28010, Madrid",40.428411350000005,-3.69698680303162
"Descubre por qué tantos viajeros ven Hotel Infanta Mercedes como el hotel ideal cuando visitan Madrid. Además de aportar la combinación ideal de calidad, comodidad y ubicación, ofrece una amplia variedad de servicios diseñados para viajeros como tú.
Como está cerca de la mayoría de los puntos de referencia de Madrid, como Malasaña (3,3 km) y Barrio de Salamanca (3,8 km), Hotel Infanta Mercedes es un fantástico destino para turistas.
Las habitaciones de los huéspedes incluyen televisor de pantalla plana, minibar y aire acondicionado, y Hotel Infanta Mercedes te ayuda a que estés conectado, ya que dispone de wifi gratuito.",No hay link,Hotel Infanta Mercedes,57 €,"3,5","[""Aparcamiento público de pago dentro del recinto"",""Garaje"",""Internet de alta velocidad gratuito (wifi)"",""Restaurante"",""Salas de reuniones"",""Espacio para guardar el equipaje"",""Conserje"",""Recepción 24 horas"",""Aire acondicionado"",""Mesa de escritorio"",""Servicio de limpieza"",""Caja fuerte"",""Teléfono"",""Minibar"",""Televisor de pantalla plana"",""Secador de pelo""]","[""Habitaciones de no fumadores""]","Calle de Huesca, 21, 28020, Madrid",40.458056850000006,-3.698503020731591
"El Hotel Madrid Centro Affiliated by Meliá te invita al lugar donde los musicales, las compras, la gastronomía y los principales centros culturales conviven en una calle única de gran vitalidad: La Gran Vía de Madrid. Alójate en el centro de Madrid y te asesoraremos qué hacer en esta fantástica ciudad. Descubre uno de los céntricos hoteles en Madrid que te ofrece Meliá, para visitar cada rincón y enclave turístico de la ciudad durante tu estancia. Un lugar idóneo para descansar tras recorrer las calles más famosas y concurridas de la Villa. Entre sus magníficas instalaciones, el Hotel cuenta con un gimnasio gratuito de uso exclusivo para nuestros clientes, un parking público concertado con descuento para los huéspedes y áreas de descanso. Las luminosas habitaciones del Hotel Madrid Centro Affiliated by Meliá incluyen free wi-fi, aire acondicionado/calefacción (según temporada), caja fuerte y amenities de baño (bajo petición).",https://www.tripadvisor.es/Commerce?p=Melia_BA&src=183763440&geo=228468&from=Hotel_Review&area=&slot=1&matchID=1&oos=0&cnt=1&silo=38053&bucket=934836&nrank=1&crank=1&clt=CLD&ttype=ContactLinkDesktop&tm=258370083&managed=false&capped=false&gosox=g3xMt9YCHBy3ZUg-YypssegjQviHlJQg6b-lnBPg98x_z9Z0XP9pjcZi3RyRnEOZNW4uQjA6ZTMVrHLSj-KP7FaVKA_eOP0Tr--8UjAzGtc&adults=2&child_rm_ages=&inDay=19&outDay=20&rooms=1&dated=true&inMonth=3&inYear=2023&outMonth=3&outYear=2023&def_d=true&bapid=1&cs=13dc72ac83de981c8f50f361599aa8035&ba_uid=654922e7-497c-4cf2-9f6d-9612af0ec3ef,Hotel Madrid Centro Affiliated by Meliá,104 €,"3,5","[""Aparcamiento público de pago cerca"",""Internet de alta velocidad gratuito (wifi)"",""Sauna"",""Desayuno bufé"",""Alquiler de bicicletas"",""Guardería"",""Canales de televisión infantiles"",""Alquiler de coches"",""Cortinas opacas"",""Aire acondicionado"",""Mesa de escritorio"",""Balcón privado"",""Caja fuerte"",""Teléfono"",""Televisor de pantalla plana"",""Secador de pelo""]","[""Habitaciones de no fumadores"",""Habitaciones para familias""]","Calle Gran Vía, 72, 28015, Madrid",40.47083205,-3.871344282431271
"Todo el mundo necesita un sitio donde reposar cuando está cansado. Para aquellos que visiten Madrid, Novotel Madrid Campo de las Naciones es una magnífica elección para descansar. Conocido por su ambiente para familias y su proximidad a fantásticos restaurantes y atracciones, Novotel Madrid Campo de las Naciones te ayuda a disfrutar de lo mejor de Madrid.
Madrid Novotel ofrece una gran variedad de servicios en la habitación, como televisor de pantalla plana, aire acondicionado y minibar, y puedes permanecer conectado, ya que hay wifi gratuito disponible.",,Novotel Madrid Campo De Las Naciones Hotel,131 €,"4,0","[""Aparcamiento público de pago dentro del recinto"",""Internet de alta velocidad gratuito (wifi)"",""Piscina"",""Gimnasio / Sala de entrenamiento"",""Bar/salón"",""Estancia gratuita para niños"",""Canales de televisión infantiles"",""Se admiten mascotas"",""Aire acondicionado"",""Servicio de limpieza"",""Servicio de habitaciones"",""Caja fuerte"",""Minibar"",""Televisor de pantalla plana""]","[""Habitaciones de no fumadores"",""Suites"",""Habitaciones para familias""]","Calle Amsterdam, 3, 28042, Madrid",40.4623825,-3.6145444
"Hotel nuevo. Perfecto para pasar noche si tienes escala del avión en barajas. A 5 minutos del aeropuerto en coche y se puedes aparcar facilmente frente al hotel. Hotel con buen ambiente y todas las comodided. Por ponerle un ""pero"" la cama me parece pequeña para dos persona. Pero para pasar una noche o dos Recomendable.",No hay link,Zleep Hotel Madrid Airport,65 €,"3,5",[],[],"Avenida de Aragón, 402, 28022, Madrid",40.4476894,-3.5483294
"Descubre por qué tantos viajeros ven Hotel Barajas Plaza como el hotel ideal cuando visitan Madrid. Además de aportar la combinación ideal de calidad, comodidad y ubicación, ofrece un ambiente para familias con una amplia variedad de servicios diseñados para viajeros como tú.
Los puntos de referencia de los alrededores, como Sculpture of Fingers (2,1 km) y Castillo de la Alameda (2,1 km) hacen de Hotel Barajas Plaza un magnífico sitio donde alojarse durante un viaje a Madrid.",No hay link,Hotel Barajas Plaza,68 €,"3,5","[""Aparcamiento privado de pago dentro del recinto"",""Internet de alta velocidad gratuito (wifi)"",""Cafetería"",""Conserje"",""Hotel de no fumadores"",""Recepción 24 horas"",""Lavado en seco"",""Autoservicio de lavandería"",""Aire acondicionado"",""Mesa de escritorio"",""Teléfono"",""Servicio despertador/reloj con alarma"",""Televisor de pantalla plana"",""Bañera/ducha"",""Secador de pelo""]","[""Habitaciones de no fumadores""]","Calle de Camarillas, 5-7, 28042, Madrid",40.4728241,-3.576856
"Localizacion inmejorable, entre Puerta del Sol y Gran Via. Cocina y comedor completo con todos los electrodomesticos y grandes mesas para comer en compania. Comodos banos individuales con lavamanos y duchas con secador y espejo. Habitaciones con calefaccion y aire acondicionado. Recepcion 24 horas. Desayuno ""madrileno"". Relacion calidad/precio excelente.",No hay link,Sungate One Hostel,127 €,"5,0","[""Internet de alta velocidad gratuito (wifi)"",""Desayuno gratuito"",""Personal de animación"",""Espacio para guardar el equipaje"",""Hotel de no fumadores"",""Registro de entrada 24 horas"",""Recepción 24 horas"",""Servicio de lavandería"",""Aire acondicionado"",""Servicio de limpieza"",""Caja fuerte""]","[""Habitaciones de no fumadores"",""Habitaciones para familias""]","Calle Carmen, 16, 28013, Madrid",40.4187084,-3.7045358
"Hermoso Palacio del siglo XIX ubicado en el distrito de Las Letras, en Madrid, el NH Collection Palacio de Tepa se encuentra rodeado de historia y romanticismo. Al lado de la Plaza Santa Ana y a sólo cinco minutos a pie, de la famosa Plaza Mayor.",,NH Collection Palacio de Tepa,175 €,"4,5","[""Servicio de aparcacoches"",""Internet de alta velocidad gratuito (wifi)"",""Gimnasio / Sala de entrenamiento"",""Bar/salón"",""Guardería"",""Se admiten mascotas"",""Transporte desde/al aeropuerto"",""Centro de negocios con acceso a Internet"",""Aire acondicionado"",""Balcón privado"",""Servicio de habitaciones"",""Caja fuerte"",""Teléfono"",""Equipamiento para sala VIP"",""Minibar"",""Televisor de pantalla plana"",""Suite nupcial""]","[""Habitaciones de no fumadores"",""Suites""]","Calle de San Sebastián, 2, 28012, Madrid",40.413905299999996,-3.7017441168167973
"B&B Madrid Centro Fuencarral 52 es un hotel Boutique en el corazón de Madrid, a pocos metros de Gran Vía o la Plaza Puerta del Sol. Situado en la Calle Fuencarral 52, se encuentra en unas de las calles más trendy de la capital, rodeado de tiendas de moda y restaurantes.
Ofrece internet de alta velocidad Wi-Fi en todo el hotel, servicio de recepción 24 horas, terraza en la azotea con zona de relax, Coffee Corner con café, infusiones y fruta gratuita las 24 horas y unas vistas impresionantes de Madrid.",No hay link,B&B Hotel Madrid Fuencarral 52,111 €,"4,5","[""Aparcamiento privado de pago cerca"",""Internet de alta velocidad gratuito (wifi)"",""Cafetería"",""Servicio de taxi"",""Terraza en el ático"",""Espacio para guardar el equipaje"",""Registro de entrada 24 horas"",""Recepción 24 horas"",""Cortinas opacas"",""Aire acondicionado"",""Mesa de escritorio"",""Servicio de limpieza"",""Cafetera/tetera"",""TV por cable o satélite"",""Ducha a ras de suelo""]","[""Habitaciones insonorizadas"",""Vistas a la ciudad"",""Habitaciones de no fumadores""]","Calle Fuencarral, 52, 28004, Madrid",40.4234879,-3.700596
"Inaugurado en diciembre de 2011, El Rincón de Gran Vía está situado a 50 m de la estación de metro de Plaza de España, en la penúltima y última planta (ático) del edificio Gran Vía 67, y cuenta con recepción 24 h y wifi gratuito en todo el establecimiento.Todas las habitaciones son amplias, con suelo de madera. Disponen de aire acondicionado, TV plana de 32” ó 26” , canales internacionales, minibar y set de té y café; la mayoría de ellas, disponen de terraza independiente y algunas con magníficas vistas al Palacio Real, Catedral de la Almudena, Teatro de la Ópera…Los numerosos restaurantes, espectáculos y centros comerciales de alrededor de la Gran Vía madrileña, componen una oferta de ocio muy completa.",No hay link,El Rincon de Gran Via,80 €,"4,0","[""Internet de alta velocidad gratuito (wifi)"",""Wifi"",""Desayuno bufé"",""Tronas disponibles"",""Espacio para guardar el equipaje"",""Conserje"",""Hotel de no fumadores"",""Servicio de lavandería"",""Aire acondicionado"",""Mesa de escritorio"",""Balcón privado"",""Caja fuerte"",""Cafetera/tetera"",""Minibar"",""Televisor de pantalla plana"",""Artículos de aseo gratuitos de cortesía""]","[""Habitaciones de no fumadores""]","Calle Gran Vía, 67, 28013, Madrid",40.47083205,-3.871344282431271
"El Petit Palace President Castellana está a pocos pasos de la Plaza de Colón y la estación de metro Rubén Darío está a 500 m. La Fuente de Cibeles y el Parque del Retiro están a 2 km del hotel. Situado en el barrio de Salamanca de Madrid, este hotel está a 50 m del Paseo de la Castellana. Cuenta con habitaciones luminosas y elegantes y conexión Wi-Fi gratuita. Otras instalaciones incluyen alquiler gratuito de bicicletas y sillas de paseo para niños, y las mascotas son bienvenidas. Disfrute de nuestro delicioso desayuno buffet.",No hay link,Hotel Petit Palace President Castellana,121 €,"4,0","[""Aparcamiento público de pago cerca"",""Internet de alta velocidad gratuito (wifi)"",""Desayuno disponible"",""Alquiler de bicicletas"",""Bicicletas disponibles"",""Tronas disponibles"",""Carritos de bebé"",""Se admiten mascotas"",""Cortinas opacas"",""Aire acondicionado"",""Mesa de escritorio"",""Servicio de limpieza"",""Servicio de habitaciones"",""Minibar"",""Televisor de pantalla plana"",""Artículos de aseo gratuitos de cortesía""]","[""Habitaciones de no fumadores"",""Habitaciones para familias""]","Calle del Marqués de Villamagna, 4, 28001, Madrid",40.429108049999996,-3.6884805508787624
"Si buscas un hotel pequeño con encanto en Madrid, no te pierdas The Walt Madrid.
Para aquellos interesados en visitar puntos de referencia conocidos durante su viaje a Madrid, The Walt Madrid se encuentra cerca de Plaza de Santa Ana (0,7 km) y Plaza Mayor (0,7 km).
Las habitaciones de los huéspedes ofrecen servicios como minibar y aire acondicionado, y los huéspedes pueden permanecer conectados con wifi gratuito que ofrece el hotel pequeño.",No hay link,The Walt Madrid,144 €,"4,5","[""Aparcamiento público de pago dentro del recinto"",""Internet de alta velocidad gratuito (wifi)"",""Bar/salón"",""Patio"",""Canales de televisión infantiles"",""Actividades para niños (acondicionado para familias / niños)"",""Transporte desde/al aeropuerto"",""Espacio para guardar el equipaje"",""Aire acondicionado"",""Mesa de escritorio"",""Servicio de limpieza"",""Balcón privado"",""Minibar"",""Hervidor eléctrico"",""Televisor de pantalla plana"",""Bañera/ducha""]","[""Vistas a la ciudad"",""Vistas a sitios de interés turístico"",""Habitaciones de no fumadores"",""Suites""]","Calle del Barco, 3, 28004, Madrid",40.421212499999996,-3.7030670022720233
"Todo el mundo necesita un sitio donde reposar cuando está cansado. Para aquellos que visiten Madrid, ILUNION Atrium es una magnífica elección para descansar. Conocido por su ambiente de moda y su proximidad a fantásticos restaurantes y atracciones, ILUNION Atrium te ayuda a disfrutar de lo mejor de Madrid.
Se ofrece wifi gratuito a los huéspedes y las habitaciones de ILUNION Atrium incluyen televisor de pantalla plana, aire acondicionado y minibar.",,ILUNION Atrium,78 €,"4,0","[""Servicio de aparcacoches"",""Internet de alta velocidad gratuito (wifi)"",""Piscina exterior"",""Gimnasio / Sala de entrenamiento"",""Bar/salón"",""Alquiler de coches"",""Centro de negocios con acceso a Internet"",""Instalaciones para conferencias"",""Cortinas opacas"",""Aire acondicionado"",""Mesa de escritorio"",""Servicio de habitaciones"",""Caja fuerte"",""Minibar"",""Televisor de pantalla plana"",""Bañera/ducha""]","[""Habitaciones de no fumadores"",""Suites"",""Habitaciones para familias""]","Calle Emilio Vargas, 3-5, 28043, Madrid",40.4487516,-3.6524497
"En el corazón de Madrid, en plena Gran Vía y Plaza Callao.Edificio emblemático de la arquitectura civil madrileña “Art Deco”, perfecta conservación de elementos originales.En sus bajos se aloja una de las salas de cine más emblemáticas de la Gran Vía madrileña, cines Capitol.",No hay link,Vincci Capitol Hotel,121 €,"4,0","[""Aparcamiento privado de pago cerca"",""Internet de alta velocidad gratuito (wifi)"",""Bar/salón"",""Alquiler de coches"",""Centro de negocios con acceso a Internet"",""Salas de reuniones"",""Terraza en el ático"",""Espacio para guardar el equipaje"",""Cortinas opacas"",""Aire acondicionado"",""Mesa de escritorio"",""Servicio de limpieza"",""Minibar"",""Televisor de pantalla plana"",""Bañera/ducha"",""Suite nupcial""]","[""Habitaciones insonorizadas"",""Habitaciones de no fumadores"",""Suites"",""Habitaciones para familias""]","Calle Gran Vía, 41, 28013, Madrid",40.47083205,-3.871344282431271
