descripcion,link,nombre,precio,puntuacion,serv_hab,tipo_hab,ubicacion,lat,long
"El hotel Petit Palace Carmen está situado en el corazón de Madrid, en la popular plaza ""Plaza del Carmen"", donde se encuentra el principal aparcamiento público de Madrid y los típicos bares de tapas, a la vuelta de la esquina de la calle principal ""Gran Vía"" y la famosa ""Puerta del Sol"".
Sus amplias y luminosas habitaciones con ventanas altas y una decoración contemporánea han sido equipadas con una amplia gama de comodidades modernas y útiles para garantizar una estancia relajante e inolvidable. El hotel se esfuerza por brindar a los huéspedes un alojamiento de calidad que no solo sea asequible, sino que también se complemente con personal profesional y servicios confiables. Las habitaciones están disponibles bajo petición con camas gemelas o de matrimonio, vistas exteriores o interiores y nuestras destacadas habitaciones Familiares tienen capacidad para hasta 4 personas, ideales para familias o grupos de amigos. Si tienes alguna petición especial (habitación especial para luna de miel, petición de ect) no dude en ponerse en contacto con nosotros, ¡estaremos encantados de hacer que su estancia sea lo más memorable posible! ¡¡TODO LO QUE NECESITA PARA DISFRUTAR DE SU ESTANCIA EN MADRID!!",No hay link,Petit Palace Plaza del Carmen,137 €,"4,5","[""Aparcamiento público de pago cerca"",""Internet de alta velocidad gratuito (wifi)"",""Desayuno disponible"",""Alquiler de bicicletas"",""Bicicletas disponibles"",""Tronas disponibles"",""Carritos de bebé"",""Se admiten mascotas"",""Aire acondicionado"",""Mesa de escritorio"",""Servicio de limpieza"",""Balcón privado"",""Teléfono"",""Minibar"",""Televisor de pantalla plana""]","[""Habitaciones insonorizadas"",""Habitaciones de no fumadores""]","Plaza del Carmen, 4, 28013, Madrid",40.4189577,-3.7028511
"ALÓJATE EN PLENO CENTRO
Descubre la arrebatadora pasión de una de las capitales más exóticas de Europa desde el hotel Hotel Madrid Atocha Affiliated by Meliá. Enclavado en el centro histórico de la ciudad, llamado el Barrio de las Letras, y cerca de la Puerta del Sol, este hotel de Madrid te permite ir andando a los afamados museos de la ciudad, a bares de tapas deliciosas y a tiendas exclusivas, así como disfrutar de la animada vida nocturna madrileña. Deja que nuestro equipo de profesionales te pongan al día de lo mejor que esta ciudad puede ofrecerte.",,Hotel Madrid Atocha Affiliated by Meliá,143 €,"4,0","[""Internet de alta velocidad gratuito (wifi)"",""Sauna"",""Bar/salón"",""Alquiler de bicicletas"",""Alquiler de coches"",""Centro de negocios con acceso a Internet"",""Instalaciones para conferencias"",""Espacio para guardar el equipaje"",""Cortinas opacas"",""Aire acondicionado"",""Mesa de escritorio"",""Chimenea"",""Servicio de habitaciones"",""Minibar"",""Televisor de pantalla plana"",""Bañera/ducha""]","[""Habitaciones de no fumadores"",""Habitaciones para familias""]","Calle de Atocha, 83, 28012, Madrid",40.4116411,-3.6974855
"Hostal Valencia es una magnífica elección para los viajeros que visiten Madrid, ya que ofrece un ambiente para familias, además de numerosos servicios diseñados para mejorar tu estancia.
Para aquellos interesados en visitar puntos de referencia conocidos durante su viaje a Madrid, Hostal Valencia se encuentra cerca de Plaza Mayor (0,6 km) y Plaza de Santa Ana (0,7 km).
Para que te sientas como en casa, las habitaciones en el hotel incluyen televisor de pantalla plana y aire acondicionado, y mantenerte conectado es fácil, ya que hay wifi gratuito disponible.",No hay link,Hostal Valencia,50 €,"3,5","[""Internet de alta velocidad gratuito (wifi)"",""Wifi"",""Conserje"",""Hotel de no fumadores"",""Aire acondicionado"",""Caja fuerte"",""Televisor de pantalla plana"",""Bañera/ducha"",""Secador de pelo""]","[""Habitaciones de no fumadores"",""Habitaciones para familias""]","Calle Gran Vía, 44, 28013, Madrid",40.4710156,-3.8715259
"Si buscas un complejo turístico con todo incluido para familias en Madrid, no te pierdas Hostal Atocha Almudena Martin.
Los puntos de referencia de los alrededores, como Plaza de Santa Ana (0,1 km) y Plaza Mayor (0,6 km) hacen de Hostal Atocha Almudena Martin un magnífico sitio donde alojarse durante un viaje a Madrid.
Hostal Atocha Almudena Martin ofrece una gran variedad de servicios en la habitación, como aire acondicionado y mesa de escritorio, y puedes permanecer conectado, ya que hay wifi gratuito disponible.",No hay link,Hostal Atocha Almudena Martin,79 €,"4,0","[""Aparcamiento privado de pago cerca"",""Aparcamiento"",""Internet de alta velocidad gratuito (wifi)"",""Cafetería"",""Servicio de traslado en autobús"",""Espacio para guardar el equipaje"",""Conserje"",""Recepción 24 horas"",""Aire acondicionado"",""Mesa de escritorio"",""Servicio de limpieza"",""Caja fuerte"",""Teléfono"",""Televisor de pantalla plana"",""Bañera/ducha"",""Secador de pelo""]","[""Habitaciones de no fumadores""]","Calle de Atocha, 43, 28012, Madrid",40.4134307,-3.7010733
"Un nuevo hotel boutique 4 estrellas llega para sumarse a la lista de hoteles de lujo en el Centro de Madrid. Elegante y de diseño contemporáneo, el Hotel TÓTEM MADRID está situado en un edificio del siglo XIX completamente restaurado, localizado en la esquina de la calle Hermosilla con Lagasca, en pleno corazón del Barrio de Salamanca, uno de los barrios más nobles de la capital y donde se concentran las boutiques más refinadas y tiendas de lujo. A un paseo del hotel o unos minutos en coche o metro, están el centro de Madrid y los Museos del Triángulo del Arte.",No hay link,TÓTEM Madrid,224 €,"4,5","[""Servicio de aparcacoches"",""Internet de alta velocidad gratuito (wifi)"",""Gimnasio / Sala de entrenamiento"",""Bar/salón"",""Tronas disponibles"",""Transporte desde/al aeropuerto"",""Vigilancia 24 horas"",""Espacio para guardar el equipaje"",""Habitación hipoalergénica"",""Cortinas opacas"",""Aire acondicionado"",""Mesa de escritorio"",""Servicio de limpieza"",""Minibar"",""Televisor de pantalla plana"",""Bañera/ducha""]","[""Habitaciones de no fumadores"",""Suites""]","Calle de Hermosilla, 23, 28001, Madrid",40.4264897,-3.6854696
"La búsqueda del hotel pequeño para familias ideal en Madrid no tiene por qué ser difícil. Bienvenido a Hostal Hispano, una fantástica opción para viajeros como tú.
Las habitaciones de Hotel Hostal Hispano incluyen televisor de pantalla plana, aire acondicionado y mesa de escritorio para una comodidad mucho mayor, y los huéspedes pueden permanecer conectados con wifi gratuito.
Conserje, espacio para guardar el equipaje y registro de entrada y salida exprés son algunos de los servicios que ofrece el hotel pequeño. Si vas en coche a Hotel Hostal Hispano, hay aparcamiento disponible.",No hay link,Hostal Hispano Gran Via,95 €,"4,0","[""Garaje"",""Internet de alta velocidad gratuito (wifi)"",""Wifi"",""Máquina expendedora"",""Servicio de taxi"",""Espacio para guardar el equipaje"",""Hotel de no fumadores"",""Registro de entrada y salida exprés"",""Aire acondicionado"",""Mesa de escritorio"",""Servicio de limpieza"",""Servicio despertador/reloj con alarma"",""Televisor de pantalla plana"",""Bañera/ducha"",""Artículos de aseo gratuitos de cortesía"",""Secador de pelo""]","[""Habitaciones de no fumadores""]","Calle de Hortaleza, 38, 28004, Madrid",40.4219968,-3.699778
"En las habitaciones de chic&basic dot te espera un ambiente acogedor. Ya sea para una noche loca, una sesión de fotos, un atracón de series improvisado o un merecido descanso. Tú decides si es un punto y seguido, un punto y aparte o un punto final. Exclusivamente creadas para ti. Descubre nuestras habitaciones exteriores e interiores, íntimas o llenas de luz natural y con un cuidado flamante diseño. Reserva ya tu habitación y descubre las diferentes ofertas que te propone nuestro hotel en Madrid. En ellas encontrarás el espacio idóneo para que le des tu propio significado a tu ‘dot’. Diseño minimalista y el ‘punto’ como artista principal del lugar, capaces de crear una identidad visual, enérgica e inspiradora, llevándote a explorar un nuevo universo repleto de experiencias extraordinarias",No hay link,Chic & Basic Dot Hotel,94 €,"4,5","[""Wifi"",""Desayuno disponible"",""Servicio de taxi"",""Vigilancia 24 horas"",""Conserje"",""Registro de entrada 24 horas"",""Recepción 24 horas"",""Secadora"",""Cortinas opacas"",""Aire acondicionado"",""Teléfono"",""Perchero para la ropa"",""Baños privados"",""TV por cable o satélite"",""Ducha a ras de suelo""]","[""Habitaciones insonorizadas"",""Vistas a la ciudad"",""Habitaciones de no fumadores""]","Calle del Maestro Victoria 5, 28013, Madrid",40.4184766,-3.7053497
"Velázquez 45 by Pillow está situado en la mejor zona de shopping de Madrid, el Barrio de Salamanca. Es un establecimiento perfecto para el viajero tanto de ocio como de negocios,por su situación cercana a la estación de metro Velázquez y Serrano, así como también su proximidad al Museo del Prado,Reina Sofía y Tyssen. También se encuentra a un paseo del parque del Retiro,la Puerta de Alcalá y la plaza Colón.Cuenta con recepción 24 horas,habitaciones totalmente equipadas y recientemente renovadas. Disfruta de un desayuno muy variado, y de una conexión wi fi gratuita.",No hay link,Velazquez 45 by Pillow,119 €,"4,0","[""Aparcamiento público de pago cerca"",""Internet de alta velocidad gratuito (wifi)"",""Bar/salón"",""Alquiler de coches"",""Espacio para guardar el equipaje"",""Conserje"",""Recepción 24 horas"",""Lavado en seco"",""Aire acondicionado"",""Caja fuerte""]","[""Habitaciones de no fumadores"",""Habitaciones para familias""]","Calle Velázquez, 45, 28001, Madrid",40.5947186,-4.1423505
"Visitar Madrid no es como visitar otras ciudades. Madrid no es turismo, sitios típicos y las selfies de siempre. Madrid es una ciudad que hay que experimentar, que vivir, que disfrutar.
Y podrás conseguirlo de la mano de Akeah, el hotel siempre despierto en la ciudad que nunca duerme.
Akeah Hotel Gran Vía Only Adults, situado en el distrito Centro de Madrid, se encuentra a 600 metros de la Gran Vía, a menos de 1 km del Templo de Debod y a 11 minutos a pie del Palacio Real de Madrid. Este establecimiento cuenta con una terraza y una piscina al aire libre durante todo el año, una recepción abierta las 24 horas y WiFi gratuita en todo el establecimiento.",No hay link,Akeah Hotel Gran Vía,135 €,"4,0","[""Aparcamiento privado de pago cerca"",""Internet de alta velocidad gratuito (wifi)"",""Piscina"",""Bar/salón"",""Transporte desde/al aeropuerto"",""Solo para adultos"",""Terraza en el ático"",""Recepción 24 horas"",""Aire acondicionado"",""Armario"",""Baños privados"",""Cafetera/tetera"",""Minibar"",""Televisor de pantalla plana"",""Bañera/ducha"",""Artículos de aseo gratuitos de cortesía""]","[""Vistas a la ciudad"",""Habitaciones de no fumadores""]","Calle de San Bernardo, 48, 28015, Madrid",40.42490285,-3.707128255780155
"El personal no es muy amable ni tampoco muy profesional. Solo ponen problemas en vez de buscar soluciones a las demandas del cliente. El desayuno es muy muy deficitario, de una ínfima variedad, cantidad y calidad. En mi opinión, este hotel no debería tener 3 estrellas.",No hay link,"Hotel Indigo Madrid - Princesa, an IHG Hotel",135 €,"3,5","[""Internet de alta velocidad gratuito (wifi)"",""Gimnasio / Sala de entrenamiento"",""Restaurante"",""Actividades para niños (acondicionado para familias / niños)"",""Salas de reuniones"",""Conserje"",""Hotel de no fumadores"",""Servicio de lavandería"",""Servicio de limpieza"",""Servicio de habitaciones""]","[""Habitaciones de no fumadores""]","Calle del Marqués de Urquijo, 4, 28008, Madrid",40.430693000000005,-3.7169560321565225
"Si buscas un hotel en Madrid, no te pierdas Espahotel Plaza Basilica.
Como está cerca de la mayoría de los puntos de referencia de Madrid, como Malasaña (2,4 km) y Templo de Debod (3,1 km), Espahotel Plaza Basilica Hotel es un fantástico destino para turistas.
Para que te sientas como en casa, las habitaciones en el hotel incluyen aire acondicionado, minibar y frigorífico, y mantenerte conectado es fácil, ya que hay wifi gratuito disponible.",No hay link,Espahotel Plaza Basilica,90 €,"3,5","[""Aparcamiento privado de pago dentro del recinto"",""Internet de alta velocidad gratuito (wifi)"",""Bar/salón"",""Transporte desde/al aeropuerto"",""Centro de negocios con acceso a Internet"",""Espacio para guardar el equipaje"",""Conserje"",""Recepción 24 horas"",""Aire acondicionado"",""Servicio de limpieza"",""Caja fuerte"",""Sofá"",""Cocina americana"",""Minibar"",""Televisor de pantalla plana"",""Bañera/ducha""]","[""Habitaciones de no fumadores"",""Suites""]","Calle del Aviador Zorita, 27-31, 28020, Madrid",40.449592,-3.6983528
"¿Buscas donde alojarte en Madrid? Entonces no te pierdas Hostal Felipe V, un hotel para familias que te acerca a lo mejor de Madrid.
Las habitaciones incluyen aire acondicionado, y es posible permanecer conectado, ya que hay wifi gratuito disponible, para que disfrutes de tu descanso con comodidad.
Felipe V ofrece recepción abierta 24 horas y espacio para guardar el equipaje. Los huéspedes que lleguen en coche tienen acceso a aparcamiento público de pago cerca.",No hay link,OYO Hostal Felipe V,78 €,"4,0","[""Aparcamiento público de pago cerca"",""Internet de alta velocidad gratuito (wifi)"",""Wifi"",""Transporte desde/al aeropuerto"",""Servicio de traslado en autobús"",""Espacio para guardar el equipaje"",""Conserje"",""Recepción 24 horas"",""Habitación hipoalergénica"",""Cortinas opacas"",""Aire acondicionado"",""Mesa de escritorio"",""Servicio de limpieza"",""Caja fuerte"",""Televisor de pantalla plana"",""Ducha a ras de suelo""]","[""Habitaciones de no fumadores""]","Calle Gran Vía, 15, 28013, Madrid",40.4725992,-3.8717231
"Hostal La Casa de La Plaza es una magnífica elección para viajeros que vayan a Madrid, ya que ofrece un ambiente económico además de numerosos servicios diseñados para mejorar su estancia.
Se ofrece wifi gratuito a los huéspedes y las habitaciones de La Casa De La Plaza incluyen televisor de pantalla plana.
Durante la estancia, disfruta de algunos de los servicios que ofrecen, como recepción abierta 24 horas.",No hay link,Hostal La Casa de La Plaza,76 €,"4,0","[""Internet de alta velocidad gratuito (wifi)"",""Wifi"",""Hotel de no fumadores"",""Baño compartido"",""Balcón privado"",""Televisor de pantalla plana""]","[""Habitaciones de no fumadores""]","Plaza de San Miguel, 5, 28005, Madrid",40.4152297,-3.7087684
"Descubre por qué tantos viajeros ven Hostal la Perla Asturiana como el hotel ideal cuando visitan Madrid. Además de aportar la combinación ideal de calidad, comodidad y ubicación, ofrece un ambiente para familias con una amplia variedad de servicios diseñados para viajeros como tú.
Al contar con muchos conocidos puntos de referencia en las inmediaciones, como Plaza Mayor (0,1 km) y Sobrino de Botín (0,2 km), los huéspedes de Hostal la Perla Asturiana tienen la oportunidad de visitar con facilidad algunas de las atracciones más populares de Madrid.",No hay link,Hostal la Perla Asturiana,145 €,"4,0","[""Aparcamiento público de pago cerca"",""Internet de alta velocidad gratuito (wifi)"",""Wifi"",""Espacio para guardar el equipaje"",""Hotel de no fumadores"",""Recepción 24 horas"",""Servicio de lavandería"",""Aire acondicionado"",""Servicio de limpieza"",""Caja fuerte"",""Televisor de pantalla plana""]","[""Habitaciones de no fumadores"",""Habitaciones para familias""]","Plaza de Santa Cruz, 3, 28012, Madrid",40.4150711,-3.7058964
No disponible,No hay link,Bluesock Hostels Madrid,64 €,"3,5","[""Internet de alta velocidad gratuito (wifi)"",""Wifi"",""Bar/salón"",""Aire acondicionado""]",[],"Calle Gran Vía, 6, 28013, Madrid",40.473399549999996,-3.8724069415983022
"Es un hostal sencillo, pero todo muy limpio. La cama es bastante cómoda, pero no elegí el tipo de habitación correcto, ya que era excesivamente pequeña. En otra ocasión elegiré la habitación doble con dos camas ya que penas hay espacio para moverte en la habitación debido al tamaño.",No hay link,Golden Alcalá,61 €,"3,5","[""Internet de alta velocidad gratuito (wifi)"",""Actividades para niños (acondicionado para familias / niños)""]",[],"Calle de Alcalá, 288, 28027, Madrid",40.4324871,-3.6517108
"Eurobuilding2 es un cómodo Aparthotel en Madrid, a sólo pocos metros del Paseo de la Castellana y del estadio Santiago Bernabeu. Está muy bien comunicado por transporte público, teniendo cerca la línea 1 parada Tetúan (directa al centro de la ciudad en sólo 20min) y línea 10 Cuzco (para el aeropuerto en 30min). Está ubicado en el distrito financiero de Madrid; 220 apartamentos elegantemente decorados y totalmente equipados. Por esas comodidades, es una opción funcional para reuniones de negocios, y son perfectos también para vacaciones o para alojar cualquier tipo de evento. El edificio tiene WIFI gratis.",No hay link,Apartamentos Edificio Eurobuilding 2,125 €,"3,5","[""Aparcamiento privado de pago dentro del recinto"",""Internet de alta velocidad gratuito (wifi)"",""Piscina"",""Desayuno bufé"",""Se admiten mascotas"",""Salas de reuniones"",""Solario"",""Conserje"",""Aire acondicionado"",""Cocina americana"",""Microondas"",""Frigorífico""]","[""Habitaciones de no fumadores"",""Suites"",""Habitaciones para fumadores disponibles""]","Calle de Orense, 69, 28020, Madrid",40.4590136,-3.6948449
"Rafaelhoteles Ventas se encuentra situado en la calle de Alcalá a cinco minutos a pie de la plaza de toros de las Ventas. Se trata de un hotel de aire clásico con motivos taurinos que aúna confort, estilo y tranquilidad. Muy bien comunicado al encontrarse junto a la M-30 y con estación de Metro de El Carmen frente al hotel. Dispone de 10 habitaciones individuales, 100 habitaciones dobles y una increíble suite, todas ellas totalmente equipadas con todo tipo de comodidades. A ello se unen sus cinco salones de reuniones con capacidad para acoger eventos de hasta 275 personas.",No hay link,Rafaelhoteles Ventas,79 €,"3,5","[""Aparcamiento privado de pago dentro del recinto"",""Internet gratuito"",""Desayuno disponible"",""Instalaciones para conferencias"",""Sala de banquetes"",""Espacio para guardar el equipaje"",""Hotel de no fumadores"",""Registro de entrada 24 horas"",""Cortinas opacas"",""Aire acondicionado"",""Mesa de escritorio"",""Servicio de limpieza"",""Caja fuerte"",""Minibar"",""Televisor de pantalla plana"",""Bañera/ducha""]","[""Vistas a la ciudad"",""Habitaciones de no fumadores"",""Suites""]","Calle de Alcalá, 269, 28027, Madrid",40.4351249,-3.6439432
"El hotel NH Lagasca en Madrid se encuentra en el prestigioso Barrio de Salamanca, cerca de zonas de compras exclusivas, centros de negocios y museos importantes.",,NH Madrid Lagasca,186 €,"4,0","[""Aparcamiento privado de pago cerca"",""Internet de alta velocidad gratuito (wifi)"",""Bar/salón"",""Guardería"",""Se admiten mascotas"",""Alquiler de coches"",""Espacio para guardar el equipaje"",""Prensa"",""Cortinas opacas"",""Mesa de escritorio"",""Servicio de limpieza"",""Servicio de habitaciones"",""Caja fuerte"",""Televisor de pantalla plana"",""Bañera/ducha"",""Secador de pelo""]","[""Habitaciones de no fumadores""]","Calle de Lagasca, 64, 28001, Madrid",40.4274913,-3.6849264615372626
"En el centro de la ""milla de oro"" de Madrid, podrás descubrir este hotel ""único"" que ocupa un palacio construido en el siglo XIX que fue transformado en esta joya de 44 habitaciones de lujo hace pocos años. La elegante fachada esconde en su interior una noble arquitectura con modernas habitaciones con techos altos y grandes ventanales. Un amplio y tranquilo jardín interior, con un agradable lounge al aire libre, da acceso al restaurante RAMON FREIXA MADRID convertido en poco tiempo en un ""must"" de la ciudad y reconocido con 2 estrellas Michelín y Mejor Restaurante de Madrid por el prestigioso certamen Madrid Fusión. Premios a la capacidad de este reconocido chef por las presentaciones excepcionales, el sofisticado servicio de sala, la extensa bodega, y la calidad con la búsqueda permanente de la excelencia lo hacen una ""gastroexperiencia"" de lujo única en la capital. Freixa también se ocupa de los estupendos desayunos de autor de Único.",No hay link,Hotel Único Madrid,336 €,"5,0","[""Servicio de aparcacoches"",""Bar de tapas"",""Transporte desde/al aeropuerto"",""Centro de negocios con acceso a Internet"",""Instalaciones para conferencias"",""Balneario"",""Espacio para guardar el equipaje"",""Conserje"",""Habitación hipoalergénica"",""Aire acondicionado"",""Servicio de limpieza"",""Balcón privado"",""Minibar"",""Televisor de pantalla plana"",""Secador de pelo"",""Suite nupcial""]","[""Habitaciones insonorizadas"",""Habitaciones de no fumadores"",""Suites"",""Habitaciones para familias""]","Calle Claudio Coello, 67, 28001, Madrid",40.5938943,-4.1466444
"El Hostal Alexis Madrid está situado en el centro de Madrid, junto a la plaza de Santa Ana, a solo 300 metros de la Puerta del Sol. Ofrece habitaciones modernas con aire acondicionado y conexión Wi-Fi gratuita. Las habitaciones del Hostal Alexis Madrid presentan una decoración en color rosa y blanco y están equipadas con caja fuerte y baño privado con secador de pelo. El personal de recepción puede facilitar información turística sobre Madrid. Además, el establecimiento se halla a 10 minutos a pie del Museo del Prado y el Museo Reina Sofía. Además, la plaza de Santa Ana está justo al lado y alberga cafeterías con terrazas al aire libre. La estación de metro de Sevilla se encuentra a 200 metros y comunica con todas las zonas de la ciudad. Centro de Madrid es una opción genial para los viajeros interesados en ocio nocturno, tapas y arquitectura.",No hay link,Hostal Alexis,90 €,"4,5","[""Internet de alta velocidad gratuito (wifi)"",""Wifi"",""Hotel de no fumadores"",""Aire acondicionado"",""Caja fuerte"",""Plancha"",""Televisor de pantalla plana"",""Bañera/ducha"",""Artículos de aseo gratuitos de cortesía"",""Secador de pelo""]","[""Habitaciones de no fumadores""]","Calle del Príncipe, 18, 28012, Madrid",40.4153135,-3.7003644
"El Ballesta es un Hostal de referencia entre los Hostales del centro de Madrid, su situación cerca de la Gran Vía, la Puerta del Sol, la Plaza Mayor, la Plaza de Santa Ana, el Museo del Prado, asi como de la gran variedad de Cines y Teatros, permite al viajero multitud de posibilidades para acceder a las zonas más turísticas e interesantes del centro de Madrid.Es un establecimiento recientemente reformado, moderno y económico con todos los servicios necesarios para hacer a nuestros clientes una estancia agradable, en definitiva una de las mejores opciones de los hostales situados en el centro de Madrid.Sus 35 habitaciones, tanto individuales, como dobles o triples con baño privado, televisión con pantalla plana, teléfono, calefacción, aire acondicionado, Wifi gratuito… hacen del Ballesta un hostal con una inmejorable relación calidad-precio...",,Hostal Ballesta,81 €,"4,0","[""Aparcamiento privado de pago cerca"",""Internet de alta velocidad gratuito (wifi)"",""Máquina expendedora"",""Servicio de taxi"",""Espacio para guardar el equipaje"",""Conserje"",""Registro de entrada 24 horas"",""Recepción 24 horas"",""Cortinas opacas"",""Aire acondicionado"",""Mesa de escritorio"",""Servicio de limpieza"",""Balcón privado"",""Cafetera/tetera"",""Televisor de pantalla plana"",""Bañera/ducha""]","[""Habitaciones de no fumadores"",""Habitaciones para familias""]","Calle Ballesta, 5, 28004, Madrid",40.4215446,-3.7035787
"Nuestro último edificio destaca por su inmejorable ubicación junto a la estación de Atocha, a pocos minutos a pie del Museo del Prado, del Museo reina Sofía y del parque del Retiro. Sus 23 apartamentos, desde amplios apartamentos de dos habitaciones hasta alucinantes áticos con terraza están completamente equipados y disponen de piscina, ideal para el verano de Madrid.",,Eric Vökel Boutique Apartments - Atocha Suites,107 €,"4,5","[""Aparcamiento privado de pago dentro del recinto"",""Internet de alta velocidad gratuito (wifi)"",""Piscina exterior"",""Té de cortesía"",""Tronas disponibles"",""Servicio de taxi"",""Espacio para guardar el equipaje"",""Hotel de no fumadores"",""Cortinas opacas"",""Aire acondicionado"",""Balcón privado"",""Caja fuerte"",""Cafetera/tetera"",""Televisor de pantalla plana"",""Sofá cama"",""Bañera/ducha""]","[""Habitaciones de no fumadores"",""Suites""]","Calle de Vizcaya, 9, 28045, Madrid",40.4048644,-3.694485229681546
"Bienvenido a Hostal Oriente, tu segundo hogar en Madrid. Hostal Oriente tiene como objetivo conseguir que tu visita sea lo más relajante y agradable posible, razón por la que tantos huéspedes siguen volviendo año tras año.
Durante su estancia en Oriente Hostal Hotel, los huéspedes pueden visitar Plaza Mayor (0,3 km) y Sobrino de Botín (0,4 km), que son algunas de las principales atracciones de Madrid.
Las habitaciones de Oriente Hostal Hotel ofrecen televisor de pantalla plana y aire acondicionado, y los huéspedes pueden estar conectados con wifi gratuito.",No hay link,Hostal Oriente,105 €,"4,5","[""Internet de alta velocidad gratuito (wifi)"",""Wifi"",""Máquina expendedora"",""Espacio para guardar el equipaje"",""Hotel de no fumadores"",""Recepción 24 horas"",""Servicio de lavandería"",""Aire acondicionado"",""Servicio de limpieza"",""Balcón privado"",""Caja fuerte"",""Televisor de pantalla plana""]","[""Habitaciones de no fumadores""]","Calle Arenal, 23, 28013, Madrid",40.824093000000005,-3.5321181285651786
