descripcion,link,nombre,precio,puntuacion,serv_hab,tipo_hab,ubicacion,lat,long
"Te vamos a dar tres razones de peso para que te alojes en el Hostal Avenida:
La primera: Nos encontramos en la mismísima Gran Vía… Si Madrid tuviera un corazón, nosotros estaríamos en su centro.
La segunda: El alojamiento en Madrid es, por normal general, caro. Nosotros somos una excepción: te ofrecemos habitaciones súper económicas a partir de 40 euros la noche.
La tercera: El nuestro es un hostal pequeño y acogedor, donde cuidamos al máximo la limpieza y el trato al cliente. Sin duda, te haremos sentir como en casa…",No hay link,Hostal Avenida,84 €,"4,0","[""Internet de alta velocidad gratuito (wifi)"",""Wifi"",""Máquina expendedora"",""Espacio para guardar el equipaje"",""Conserje"",""Hotel de no fumadores"",""Recepción 24 horas"",""Aire acondicionado"",""Servicio de limpieza"",""Caja fuerte""]","[""Habitaciones de no fumadores"",""Habitaciones para fumadores disponibles""]","Calle Gran Vía, 15, 28013, Madrid",40.4725992,-3.8717231
"C'est une belle résidence, près de tout. Elle est au centre ville de Madrid et à deux pas du grand boulevard Gran via. L'accueil est magnifique. Le petit déjeuner est riche et consistant. Il est donné sous forme de panier où il y a un peu de tous (lait, fromage, pomme, orange, huile d'olive, chocolat, pain, petit-pain, miel, café, conflex...). La literie est super bien avec un grand TV où tout est là (Netflix, IPTV...). J'ai fait ma réservation directement sur le site de l'hôtel. Tout est bien passé (sécurité, avantages sur le prix...) Je la recommande et j'y reviendrai.",No hay link,60 Balconies Iconic,108 €,"5,0",[],[],"Calle de Cedaceros, 6, 28014, Madrid",40.4171109,-3.6984255
"La búsqueda del hotel pequeño para familias ideal en Madrid no tiene por qué ser complicada. Bienvenido a Hostal Sardinero, una fantástica opción para viajeros como tú.
Como está muy cerca de conocidos puntos de referencia, como Plaza de Santa Ana (0,2 km) y Plaza Mayor (0,7 km), los huéspedes de Hostal Sardinero pueden acceder con facilidad a algunas de las atracciones más conocidas de Madrid.
Las habitaciones de los huéspedes ofrecen servicios como aire acondicionado, y los huéspedes pueden permanecer conectados con wifi gratuito que ofrece el hotel pequeño.",No hay link,Hostal Sardinero,67 €,"4,0","[""Internet de alta velocidad gratuito (wifi)"",""Wifi"",""Hotel de no fumadores"",""Aire acondicionado"",""Caja fuerte""]","[""Habitaciones de no fumadores""]","Calle del Prado, 16, 28014, Madrid",40.4147794,-3.698653
"Es un pequeño hotel, sencillo a buen precio. Nos hospedaron en otro edificio a 40 metros de la dirección, y las habitaciones están bien, un poco pequeñas pero muy limpias, es un buen lugar cerca del aeropuerto de Madrid. Hay un autobús que lo puedes tomar en la esquina para ir al aeropuerto y una estación del metro muy cerca para ir al centro de Madrid.",No hay link,Hospedaje Los Rosales,85 €,"3,5","[""Aparcamiento privado de pago cerca"",""Internet de alta velocidad gratuito (wifi)"",""Internet"",""Máquina expendedora"",""Actividades para niños (acondicionado para familias / niños)"",""Espacio para guardar el equipaje"",""Recepción 24 horas"",""Servicio de lavandería"",""Aire acondicionado"",""Caja fuerte""]",[],"Avenida de Logroño, 130, 28042, Madrid",40.4620457,-3.5900419
"SmartRental Chueca II está situado en el céntrico barrio de Chueca junto a los monumentos y lugares de interés más destacados de la ciudad, zona comercial, bares y restaurantes. El apartamento recién renovado tiene una decoración moderna y una cocina totalmente equipada, aire acondicionado y wifi gratuito",No hay link,SmartRental Chueca II,91 €,"3,5","[""Internet de alta velocidad gratuito (wifi)"",""Wifi"",""Tronas disponibles"",""Transporte desde/al aeropuerto"",""Hotel de no fumadores"",""Lavadora"",""Servicio de planchado"",""Aire acondicionado"",""Sofá"",""Plancha"",""Baños privados"",""Cocina americana"",""Televisor de pantalla plana"",""Sofá cama"",""Artículos de aseo gratuitos de cortesía""]","[""Habitaciones de no fumadores"",""Habitaciones para familias""]","Calle de Pérez Galdós, 7, 28004, Madrid",40.4224338,-3.7000612
"Bienvenido a Room Pride, tu segundo hogar en Madrid. Room Pride tiene como objetivo conseguir que tu visita sea lo más relajante y agradable posible, razón por la que tantos huéspedes siguen volviendo año tras año.
Para aquellos que estén interesados en visitar puntos de referencia conocidos durante su viaje a Madrid, Room Pride se encuentra cerca de Plaza de Santa Ana (0,8 km) y Plaza Mayor (1,0 km).
Las habitaciones de los huéspedes ofrecen servicios como aire acondicionado, y los huéspedes pueden permanecer conectados con wifi gratuito que ofrece el hotel pequeño.",No hay link,Room Pride,68 €,"3,0","[""Aparcamiento público de pago cerca"",""Internet de alta velocidad gratuito (wifi)"",""Wifi"",""Espacio para guardar el equipaje"",""Hotel de no fumadores"",""Aire acondicionado""]","[""Habitaciones de no fumadores""]","Calle San Bartolomé, 2, 28004, Madrid",40.7622164,-3.7880182
"Me he alojada la semana pasada durante 4 noches y he de decir que el lugar me sorprendió. Después de leer bastante críticas sobre este tipo de apartamentos he salido muy satisfecha. Para empezar el personal de recepción es bastante amable, nos indicó todo con bastante amabilidad y nos ayudaron en todo. En cuanto al apartamento, yo me alojé en un Loft y la verdad es que ha sido un acierto. Estaba limpio, tenía todo lo que puedes necesitar en cuanto a cubertería, microondas, tostadora, nevera... La cama grande y muy cómoda con opción de usar edredón nórdico. El baño la verdad es que bastante mejor de lo que me imaginaba, limpio, con agua caliente y espacioso. En cuanto a la caleffación en el Loft había 1 radiador y aparato de aire caliente en la habitación y otro radiador en el…",No hay link,Plaza Mayor Apartments,209 €,"3,5","[""Internet de alta velocidad gratuito (wifi)"",""Wifi"",""Tronas disponibles"",""Lavadora"",""Aire acondicionado"",""Zona de asientos"",""Sofá"",""Perchero para la ropa"",""Cafetera/tetera"",""Cocina americana"",""Televisor de pantalla plana"",""Bañera/ducha""]",[],"Plaza Mayor, 30, 28012, Madrid",40.4157824,-3.7066073
"La Llave De Madrid se encuentra en Madrid, a 300 metros del parque del Retiro y a 2,7 km del Museo Thyssen-Bornemisza, y ofrece alojamiento con WiFi gratuita y jardín con terraza y vistas al jardín.",No hay link,La Llave De Madrid,255 €,"3,5","[""Internet de alta velocidad gratuito (wifi)"",""Actividades para niños (acondicionado para familias / niños)"",""Hotel de no fumadores"",""Aire acondicionado"",""Cocina americana""]","[""Habitaciones para familias""]","Calle de Narvaez, 70, 28009, Madrid",40.41777635,-3.6766091428003653
"Hostal Bianco es una magnífica elección para viajeros que vayan a Madrid, ya que ofrece un ambiente económico además de numerosos servicios diseñados para mejorar su estancia.
Se ofrece wifi gratuito a los huéspedes y las habitaciones de Hostal Bianco incluyen televisor de pantalla plana, aire acondicionado y frigorífico.
Durante la estancia, disfruta de algunos de los servicios que ofrecen, como recepción abierta 24 horas y espacio para guardar el equipaje. Para viajeros con coche hay aparcamiento público de pago cerca disponible.",No hay link,Hostal Bianco,124 €,"4,0","[""Aparcamiento privado de pago dentro del recinto"",""Internet de alta velocidad gratuito (wifi)"",""Wifi"",""Servicio de desayuno en la habitación"",""Espacio para guardar el equipaje"",""Hotel de no fumadores"",""Recepción 24 horas"",""Cortinas opacas"",""Aire acondicionado"",""Caja fuerte"",""Teléfono"",""Cafetera/tetera"",""Frigorífico"",""Televisor de pantalla plana"",""Bañera/ducha""]",[],"Calle de Echegaray, 5, 28014, Madrid",40.4159756,-3.6995699
"La ubicación excelente! En todo el centro! El trato con el personal muy bien! La habitación era acogedora y limpia. Las camas muy cómodas. Si he de decir algo negativo, es que las paredes parece la de cartón, se oye todo. El ascensor es difícil de coger.",,Hostal Carmen,123 €,"3,5","[""Aparcamiento privado de pago cerca"",""Internet de alta velocidad gratuito (wifi)"",""Internet"",""Espacio para guardar el equipaje"",""Hotel de no fumadores"",""Recepción 24 horas"",""Aire acondicionado"",""Mesa de escritorio"",""Servicio de limpieza"",""Televisor de pantalla plana"",""Artículos de aseo gratuitos de cortesía"",""Secador de pelo""]",[],"Calle Gran Vía, 44, 28013, Madrid",40.4710156,-3.8715259
"Descubre por qué tantos viajeros ven Hostal Internacional como el hotel pequeño ideal cuando visitan Madrid. Además de aportar la combinación ideal de calidad, comodidad y ubicación, ofrece un ambiente económico con una amplia variedad de servicios diseñados para viajeros como tú.
Las habitaciones incluyen aire acondicionado, y es posible permanecer conectado, ya que hay wifi gratuito disponible, para que disfrutes de tu descanso con comodidad.",No hay link,Hostal Internacional,112 €,"4,0","[""Internet de alta velocidad gratuito (wifi)"",""Wifi"",""Pub/DJ"",""Aire acondicionado""]","[""Habitaciones de no fumadores""]","Calle de Echegaray, 5, 28014, Madrid",40.4159756,-3.6995699
"El Hostal Rober, de gestión familiar, y en pleno centro de Madrid se encuentra a 2 minutos a pie de la Puerta del Sol. La estratégica situación del Hostal Rober, permite conocer todos los lugares de interés turístico y cultural de la ciudad de Madrid. La Plaza Mayor, la Gran Vía y los principales museos se encuentran a escaso minutos paseando, siempre rodeados de las tiendas, bares y restaurante más emblemáticos de Madrid. El Hostal Rober ofrece los siguientes servicios: recepción 24horas, Wifi gratuita en todo el establecimiento, servicio de conserjería, consigna de equipajes y ascensor. Todas sus habitaciones están totalmente equipadas con baño privado, amenities, aire acondicionado, calefacción, TV de pantalla plana, caja fuerte, conexión Wifi, secador de pelo y plancha (bajo petición).El Hostal Rober ofrece servicio de venta de entradas e información turística, organizamos excursiones a pueblos y ciudades cercanos a Madrid, así como traslados desde el aeropuerto por un suplemento, pregunte en recepción y estaremos encantados de ayudarle.Cómo llegar desde el aeropuertoEn metro: Coger la línea 8 (rosa) en el Aeropuerto de Barajas hasta Nuevos Ministerios, donde debe coger la línea 10 (azul marino, dirección sur) hasta Alonso Martínez, hacer transbordo a la línea 5 (verde clara, dirección sur) hasta la parada de Ópera, el hostal está a menos de 100 metros.En autobús: Coger la línea Express aeropuerto hasta Atocha Renfe donde debe coger el metro, línea 1 (azul claro, dirección norte) hasta la estación de Sol, el hostal está a menos de 300 metros.Cómo llegar desde las principales estaciones de trenAtocha Renfe: Coger la línea 1 de metro (azul clara, dirección norte) hasta Sol, el hotel está a menos de 300 metros.Chamartín: Coger la línea 1 de metro (azul clara, dirección sur) hasta Sol, el hotel está a menos de 300 metros.",No hay link,Hostal Rober,86 €,"4,5","[""Internet de alta velocidad gratuito (wifi)"",""Wifi"",""Alquiler de bicicletas"",""Espacio para guardar el equipaje"",""Conserje"",""Hotel de no fumadores"",""Salón compartido/sala de televisión"",""Recepción 24 horas"",""Aire acondicionado"",""Servicio de limpieza"",""Balcón privado"",""Caja fuerte"",""Televisor de pantalla plana"",""Bañera/ducha"",""Secador de pelo""]","[""Habitaciones insonorizadas"",""Habitaciones de no fumadores""]","Calle del Arenal, 26, 28013, Madrid",40.4178642,-3.7080699
"La búsqueda de la casa de huéspedes económico ideal en Madrid no tiene por qué ser complicada. Bienvenido a Hostal Jemasaca-Palma61, una fantástica opción para viajeros como tú.
Durante su estancia en Hostal Jemasaca-Palma61, los huéspedes pueden visitar Malasaña (0,4 km) y Plaza Mayor (1,2 km), algunas de las principales atracciones de Madrid.
Disfrutarás de agradables habitaciones que incluyen aire acondicionado, y podrás estar conectado durante tu estancia, ya que Hostal Jemasaca-Palma61 ofrece wifi gratuito a los huéspedes.",No hay link,Hostal Jemasaca-Palma61,64 €,"3,5","[""Internet de alta velocidad gratuito (wifi)"",""Wifi"",""Sauna"",""Alquiler de bicicletas"",""Alquiler de coches"",""Espacio para guardar el equipaje"",""Conserje"",""Recepción 24 horas"",""Aire acondicionado"",""Chimenea"",""Servicio de limpieza"",""Televisor de pantalla plana""]","[""Habitaciones de no fumadores"",""Habitaciones para familias""]","Calle de la Palma, 61, 28015, Madrid",40.4266688,-3.7076523
"El The Garden Suites se encuentra en el centro de Madrid, cerca de la estación de metro Gran Vía, la Gran Vía y el Museo Thyssen-Bornemisza, y ofrece terraza y WiFi gratuita.",No hay link,The Garden Suites,164 €,"4,0",[],[],"Calle de los Jardines, 2, 28013, Madrid",40.4189134,-3.7018153
"El Woohoo Rooms Boutique Sol se encuentra en el distrito Centro de Madrid, a 1,4 km del Museo Reina Sofía, a menos de 1 km del Museo Thyssen-Bornemisza y a 6 minutos a pie de la Gran Vía.",No hay link,Woohoo Rooms Boutique Sol,134 €,"5,0",[],[],"Calle de Carretas, 7, 28012, Madrid",40.4163213,-3.7030556
"La búsqueda del hotel pequeño económico ideal en Madrid no tiene por qué ser difícil. Bienvenido a Hostal Alfaro, una fantástica opción para viajeros como tú.
Las habitaciones de los huéspedes ofrecen servicios como televisor de pantalla plana, aire acondicionado y mesa de escritorio, y los huéspedes pueden permanecer conectados con wifi gratuito que ofrece el hotel pequeño.
Hostal Alfaro tiene servicio de habitaciones, conserje y espacio para guardar el equipaje para que la estancia sea más agradable. El establecimiento también cuenta con bar.",,Hostal Alfaro,114 €,"3,5","[""Aparcamiento público de pago cerca"",""Internet de alta velocidad gratuito (wifi)"",""Wifi"",""Espacio para guardar el equipaje"",""Hotel de no fumadores"",""Aire acondicionado"",""Mesa de escritorio"",""Televisor de pantalla plana"",""Bañera/ducha""]","[""Habitaciones de no fumadores""]","Calle de Ventura de la Vega, 16, 28014, Madrid",40.4153702,-3.6990329
"La recepción fue sencilla, los empleados muy amables y atentos. La habitación era acogedora y moderna, con todo lo necesario. He de destacar que estaba muy limpio, algo que se agradece al dormir fuera de casa, que te hagan sentir bien... Sin duda lo recomiendo y volveré!",No hay link,Woohoo Rooms Chueca,92 €,"3,5","[""Internet de alta velocidad gratuito (wifi)"",""Internet"",""Conserje"",""Aire acondicionado""]","[""Habitaciones para familias""]","Calle de Barbieri, 3, 28004, Madrid",40.420778,-3.6982925
"La búsqueda de la casa de huéspedes económico ideal en Madrid no tiene por qué ser complicada. Bienvenido a Pension Mollo, una fantástica opción para viajeros como tú.
Al contar con muchos conocidos puntos de referencia en las inmediaciones, como Plaza de Santa Ana (0,7 km) y La Latina (1,1 km), los huéspedes de Pension Mollo tienen la oportunidad de visitar con facilidad algunas de las atracciones más populares de Madrid.
Se ofrece wifi gratuito a los huéspedes y las habitaciones de Pension Mollo incluyen televisor de pantalla plana, aire acondicionado y mesa de escritorio.",No hay link,Pension Mollo,75 €,"4,0","[""Internet de alta velocidad gratuito (wifi)"",""Internet"",""Espacio para guardar el equipaje"",""Recepción 24 horas"",""Aire acondicionado"",""Mesa de escritorio"",""Televisor de pantalla plana""]",[],"Calle de Atocha, 104, 28012, Madrid",40.410301,-3.6953849
"O hotel tem uma localização perfeita. Fica ao lado da Gran Vía, mas o local não é barulhento. De fato, a entrada do hotel é um pouco estranha, mas o local em si é limpo e organizado. Do lado de metrô, supermercado, restaurantes, Primark...tudo! Na praça que fica ao lado dormem várias pessoas de rua, mas não tivemos nenhum problema e nem nos sentimos inseguros na região. Possui uma área com chá, água e uma geladeira. A recepção não funciona 24h e poucos foram os dias que vimos alguém do hotel. Os quartos são limpos a cada dois dias. Demos azar do nosso ar condicionado quebrar e tivemos que pedir cobertores extras. O quarto é pequeno, mas possui um bom número de tomadas, espelho, cadeira, aparador e local para pendurar roupas.",No hay link,CH Lumière,57 €,"4,0",[],[],"Calle de Tres Cruces, 4, 28013, Madrid",40.4192019,-3.7028367
"Llegas a la habitación, entras al baño y se acabó todo, es lo que paso en este hostal. Hay cosas básicas que los hoteles deben cuidar, las sábanas y el baño. Si falla una de estas automáticamente es hotel que no merece nada. En la imagen puedes observar lo que conseguí. Si un hostal no es capaz de limpiar bien el baño, que se puede esperar de lo demás. Sin duda es una experiencia que no quieres repetir nunca. Este hostal está muy bien ubicado pero sin duda no aprovecha esto con un servicio de limpieza pésimo.  No se si todo se juntó pero mi estadía fue un continuo proceso de desilusión, primero la recepción te hacen sentir que estás pidiendo un favor y casi suplicando que te atienda, un uniforme para los empleados podría proyectar una imagen más formal. Luego llegas al…",No hay link,Hostal Palacios-Ribadavia,42 €,"3,5","[""Internet de alta velocidad gratuito (wifi)"",""Wifi"",""Canales de televisión infantiles"",""Actividades para niños (acondicionado para familias / niños)"",""Espacio para guardar el equipaje"",""Hotel de no fumadores"",""Recepción 24 horas"",""Servicio de lavandería"",""Servicio de limpieza""]",[],"Calle Fuencarral, 25, 28004, Madrid",40.4216839,-3.7012246
"Situado en pleno corazón de Madrid, en un edificio con arquitectura típica burguesa madrileña del S.XIX, se encuentran nuestras habitaciones con baño privado.
Estamos en la calle Caballero de Gracia donde encontrarás el oratorio más antiguo de Madrid y uno de los edificios más emblemáticos y céntricos.
Ofrecemos los servicios de corto y largo alojamiento.",No hay link,El HostAll,58 €,"3,5","[""Aparcamiento público de pago cerca"",""Garaje"",""Internet de alta velocidad gratuito (wifi)"",""Wifi"",""Registro privado de entrada y salida"",""Aire acondicionado"",""Servicio de limpieza"",""Caja fuerte"",""Frigorífico"",""Televisor de pantalla plana"",""Bañera/ducha"",""Artículos de aseo gratuitos de cortesía"",""Secador de pelo""]","[""Habitaciones de no fumadores"",""Suites"",""Habitaciones para familias""]","Calle Caballero de Gracia, 6, 28013, Madrid",40.3799497,-3.4114245
"El hostal está situado en zona céntrica de Madrid teniendo todo a la mano, tanto lugares turísticos, de ocio como de vida nocturna. La atención del personal es muy cordial y las instalaciones son buenas, tomando en cuenta relación calidad-precio. Es un hostal que recomiendo!",No hay link,Casa Chueca Hostal,118 €,"3,5","[""Internet de alta velocidad gratuito (wifi)"",""Wifi"",""Tronas disponibles"",""Secadora"",""Lavadora"",""Aire acondicionado"",""Zona de asientos"",""Sofá"",""Plancha"",""Cafetera/tetera"",""Televisor de pantalla plana"",""Artículos de aseo gratuitos de cortesía""]","[""Habitaciones insonorizadas""]","Calle San Bartolomé, 4, 28004, Madrid",40.7345756,-3.9449715
Hostal céntrico a un 1 min. de la Gran Vía a 5 min. de Sol.,No hay link,Hostal María Cristina,65 €,"4,0","[""Aparcamiento privado de pago cerca"",""Internet de alta velocidad gratuito (wifi)"",""Wifi"",""Máquina expendedora"",""Espacio para guardar el equipaje"",""Hotel de no fumadores"",""Salón compartido/sala de televisión"",""Recepción 24 horas"",""Aire acondicionado"",""Mesa de escritorio"",""Caja fuerte"",""Teléfono"",""Servicio despertador/reloj con alarma"",""Televisor de pantalla plana"",""Artículos de aseo gratuitos de cortesía"",""Secador de pelo""]","[""Habitaciones de no fumadores""]","Calle de Fuencarral, 20, 28004, Madrid",40.421831,-3.7008062
"En pleno corazón de la zona más auténtica de Madrid: Slow Suites Gran Vía es tu apartamento turístico en el centro de la capital. Alójate a un paso de la avenida más emblemática de Madrid, icono de la ciudad más moderna.
En nuestras suites encontrarás una decoración única y confortable para sentirte como en casa. Slow Suites Gran Vía es el mejor lugar para disfrutar de la cultura, las compras...",,Slow Suites Gran Via,112 €,"4,0","[""Aparcamiento público de pago cerca"",""Internet de alta velocidad gratuito (wifi)"",""Wifi"",""Hotel de no fumadores"",""Aire acondicionado"",""Cocina americana""]","[""Habitaciones de no fumadores"",""Suites"",""Habitaciones para familias""]","Calle de las Infantas, 38, 28004, Madrid",40.0343914,-3.600684
"Nos encantó la forma de hacer el checkin, el apartamento súper acogedor, todo nuevo, muy limpio, precioso, la calefacción funciona perfectamente. Tienen el detalle de tener netflix y wifi, también ponen amenities en el baño y en la cocina. Todo fabuloso! Volveremos sin lugar a dudas.",No hay link,Horoko,95 €,"4,5",[],[],"Calle Miosotis, 13, 28039, Madrid",40.4651104,-3.7021989
"Nuestra casa de huéspedes se complace en darle la bienvenida a la ciudad de Madrid. Aquí encontrará el ambiente y la comodidad de un piso céntrico, próximo a las principales atracciones turísticas, culturales y gastronómicas; un lugar excelente en el que pasar unos días en el corazón de la capital.El inmueble está ubicado en la puerta sur del barrio de Chueca, singular enclave de Madrid que en los últimos años ha cobrado gran relevancia en el ámbito comercial, residencial y de ocio.Disponemos de varios tipos de alojamiento situados en una 4ªplanta, SIN ASCENSOR.",No hay link,Hostal Casillas,60 €,"3,5","[""Internet de alta velocidad gratuito (wifi)"",""Wifi"",""Se admiten mascotas"",""Hotel de no fumadores"",""Mesa de escritorio"",""Zona de asientos"",""Televisor de pantalla plana"",""Bañera/ducha"",""Secador de pelo""]","[""Habitaciones para familias""]","Calle de Hortaleza, 4, 28004, Madrid",40.420611,-3.7007827
"Reservamos dos apartamentos, el nuestro solo se correspondía con las fotos por el color de las paredes. Era una buhardilla enana con el típico techo que se va estrechando y si te descuidas te das en la cabeza. Solo tenía dos minúsculas ventanas sin vistas, ideal para un capítulo de Mentes Criminales. No es nada luminoso, salvo cuando te vas a dormir que el tragaluz expulsa toda la luz que no te entra de día, tuvimos que dormir con una camiseta en la cara. El personal es muy agradable, pero las condiciones del apartamento distan mucho de merecer los 115€ por dos noches que pagamos cada una (460€ en total cada apartamento). Además, la puerta del portal se atasca y te quedas en la calle hasta que un vecino baje, y a las 11:00 te tienes que ir, aunque nos vino bien para frenar el…",No hay link,SLEEP El Rastro by STAY,180 €,"4,0",[],[],"Calle de Santa Ana, 25, 28005, Madrid",40.4100595,-3.708052
"La búsqueda de la casa de huéspedes boutique ideal en Madrid no tiene por qué ser complicada. Bienvenido a Casa Boutique Chueca, una fantástica opción para viajeros como tú.
Para aquellos interesados en visitar puntos de referencia conocidos durante su viaje a Madrid, Casa Boutique Chueca se encuentra cerca de Plaza de Santa Ana (1,0 km) y Malasaña (1,0 km).
Las habitaciones incluyen televisor de pantalla plana, frigorífico y aire acondicionado, y es posible permanecer conectado, ya que hay wifi gratuito disponible, para que disfrutes de tu descanso con comodidad.",No hay link,Casa Boutique Chueca,90 €,"4,0","[""Aparcamiento público de pago cerca"",""Internet de alta velocidad gratuito (wifi)"",""Servicio de desayuno en la habitación"",""Animación nocturna"",""Hotel de no fumadores"",""Mobiliario exterior"",""Recepción 24 horas"",""Registro de entrada y salida exprés"",""Aire acondicionado"",""Servicio de limpieza"",""Servicio de habitaciones"",""Caja fuerte"",""Cafetera/tetera"",""Cocina americana"",""Televisor de pantalla plana"",""Bañera/ducha"",""Suite nupcial""]",[],"Calle de Gravina, 25, 28004, Madrid",40.4226404,-3.6960961
"Hostal Rayuela es una magnífica elección para los viajeros que visiten Madrid, ya que ofrece un ambiente económico, además de numerosos servicios diseñados para mejorar tu estancia.
Al estar cerca de los puntos de referencia más conocidos de Madrid, como Malasaña (0,7 km) y Plaza de Santa Ana (0,9 km), Hostal Rayuela es un magnífico destino para turistas.
Hotel Hostal Rayuela tiene recepción abierta 24 horas y espacio para guardar el equipaje.",No hay link,CH Rayuela,102 €,"3,0","[""Internet gratuito"",""Internet"",""Espacio para guardar el equipaje"",""Secadora"",""Mesa de escritorio"",""Baños privados"",""Secador de pelo""]","[""Vistas a la ciudad""]","Calle de Fuencarral, 41, 28005, Madrid",40.4228124,-3.7008949
